{
 "book": "شكرا يامى",
 "source_pdf": "شكرا يامى.pdf",
 "pdf_sha256_16": "122b52391ef55fac",
 "page": 5,
 "source": "ocr",
 "ocr_engine": "lighton/parse-v3",
 "box_level": "none",
 "diac_ratio": 0.815,
 "path": "keep",
 "status": "extracted",
 "tokens": [
  {
   "id": "p005w000",
   "raw": "فَشَعَرَتِ",
   "txt": "فَشَعَرَتِ",
   "fixes": []
  },
  {
   "id": "p005w001",
   "raw": "الْأُمُّ",
   "txt": "الْأُمُّ",
   "fixes": []
  },
  {
   "id": "p005w002",
   "raw": "بِأَنَّ",
   "txt": "بِأَنَّ",
   "fixes": []
  },
  {
   "id": "p005w003",
   "raw": "هُنَاكَ",
   "txt": "هُنَاكَ",
   "fixes": []
  },
  {
   "id": "p005w004",
   "raw": "خَطَرًا،",
   "txt": "خَطَرًا،",
   "fixes": []
  },
  {
   "id": "p005w005",
   "raw": "فَأَخَذَتْ",
   "txt": "فَأَخَذَتْ",
   "fixes": []
  },
  {
   "id": "p005w006",
   "raw": "مِنْهَا",
   "txt": "مِنْهَا",
   "fixes": []
  },
  {
   "id": "p005w007",
   "raw": "الْآيَنِ",
   "txt": "الْآيَنِ",
   "fixes": []
  },
  {
   "id": "p005w008",
   "raw": "بَادَ.",
   "txt": "بَادَ.",
   "fixes": []
  },
  {
   "id": "p005w009",
   "raw": "بَكَثَ",
   "txt": "بَكَثَ",
   "fixes": []
  },
  {
   "id": "p005w010",
   "raw": "فَرَحُ",
   "txt": "فَرَحُ",
   "fixes": []
  },
  {
   "id": "p005w011",
   "raw": "كَثِيرًا",
   "txt": "كَثِيرًا",
   "fixes": []
  },
  {
   "id": "p005w012",
   "raw": "وَذَهَبَتْ",
   "txt": "وَذَهَبَتْ",
   "fixes": []
  },
  {
   "id": "p005w013",
   "raw": "تَبْحَثُ",
   "txt": "تَبْحَثُ",
   "fixes": []
  },
  {
   "id": "p005w014",
   "raw": "عَنْ",
   "txt": "عَنْ",
   "fixes": []
  },
  {
   "id": "p005w015",
   "raw": "بَدِيلٍ،",
   "txt": "بَدِيلٍ،",
   "fixes": []
  },
  {
   "id": "p005w016",
   "raw": "وَكَانَ",
   "txt": "وَكَانَ",
   "fixes": []
  },
  {
   "id": "p005w017",
   "raw": "أَمَامَهَا",
   "txt": "أَمَامَهَا",
   "fixes": []
  },
  {
   "id": "p005w018",
   "raw": "التَّلْفَازُ؛",
   "txt": "التَّلْفَازُ؛",
   "fixes": []
  },
  {
   "id": "p005w019",
   "raw": "فَأَخَذَتْ",
   "txt": "فَأَخَذَتْ",
   "fixes": []
  },
  {
   "id": "p005w020",
   "raw": "ثُنَابُ",
   "txt": "ثُنَابُ",
   "fixes": []
  },
  {
   "id": "p005w021",
   "raw": "عُقَوَاتِ",
   "txt": "عُقَوَاتِ",
   "fixes": []
  },
  {
   "id": "p005w022",
   "raw": "الْكَرْثُونِ",
   "txt": "الْكَرْثُونِ",
   "fixes": []
  },
  {
   "id": "p005w023",
   "raw": "وَالْبَرَامِجِ",
   "txt": "وَالْبَرَامِجِ",
   "fixes": []
  },
  {
   "id": "p005w024",
   "raw": "وَالْإِعْلَانَاتِ؛",
   "txt": "وَالْإِعْلَانَاتِ؛",
   "fixes": []
  },
  {
   "id": "p005w025",
   "raw": "حَتَّى",
   "txt": "حَتَّى",
   "fixes": []
  },
  {
   "id": "p005w026",
   "raw": "صَعُفَ",
   "txt": "صَعُفَ",
   "fixes": []
  },
  {
   "id": "p005w027",
   "raw": "نَظْرُهَا",
   "txt": "نَظْرُهَا",
   "fixes": []
  },
  {
   "id": "p005w028",
   "raw": "وَقَلَّ",
   "txt": "وَقَلَّ",
   "fixes": []
  },
  {
   "id": "p005w029",
   "raw": "تَرْكِيزُهَا،",
   "txt": "تَرْكِيزُهَا،",
   "fixes": []
  },
  {
   "id": "p005w030",
   "raw": "وَتَرَاجَعَ",
   "txt": "وَتَرَاجَعَ",
   "fixes": []
  },
  {
   "id": "p005w031",
   "raw": "تَرْتِيبُهَا",
   "txt": "تَرْتِيبُهَا",
   "fixes": []
  },
  {
   "id": "p005w032",
   "raw": "فِي",
   "txt": "فِي",
   "fixes": []
  },
  {
   "id": "p005w033",
   "raw": "الدَّرَاسَةِ.",
   "txt": "الدَّرَاسَةِ.",
   "fixes": []
  }
 ]
}