{
 "book": "المومياوات ناشيونال جيوجرافيك",
 "source_pdf": "المومياوات ناشيونال جيوجرافيك .pdf",
 "pdf_sha256_16": "a77d3a1ae7f90b76",
 "page": 33,
 "source": "ocr",
 "ocr_engine": "lighton/parse-v3",
 "box_level": "none",
 "diac_ratio": 0.079,
 "path": "diacritise",
 "status": "diacritised",
 "tokens": [
  {
   "id": "p033w000",
   "raw": "مصطلحات",
   "txt": "مُصْطَلَحَاتٍ",
   "fixes": []
  },
  {
   "id": "p033w001",
   "raw": "مصورة",
   "txt": "مُصَوَّرَةِ",
   "fixes": []
  },
  {
   "id": "p033w002",
   "raw": "التحلل:",
   "txt": "التَّحَلُّلِ:",
   "fixes": []
  },
  {
   "id": "p033w003",
   "raw": "يعني",
   "txt": "يَعْنِي",
   "fixes": []
  },
  {
   "id": "p033w004",
   "raw": "التعفن",
   "txt": "التَّعَفُّنَ",
   "fixes": []
  },
  {
   "id": "p033w005",
   "raw": "أو",
   "txt": "أَوْ",
   "fixes": []
  },
  {
   "id": "p033w006",
   "raw": "التلف.",
   "txt": "التَّلَفَ.",
   "fixes": []
  },
  {
   "id": "p033w007",
   "raw": "بكتيريا:",
   "txt": "بِكَتِيرِيًّا:",
   "fixes": []
  },
  {
   "id": "p033w008",
   "raw": "كاثنانٌ",
   "txt": "كَاثْنَانِ",
   "fixes": []
  },
  {
   "id": "p033w009",
   "raw": "حيةٌ",
   "txt": "حَيَّةٌ",
   "fixes": []
  },
  {
   "id": "p033w010",
   "raw": "صغيرة",
   "txt": "صَغِيرَةِ",
   "fixes": []
  },
  {
   "id": "p033w011",
   "raw": "الحجير",
   "txt": "الْحَجِيرِ",
   "fixes": []
  },
  {
   "id": "p033w012",
   "raw": "للغاية",
   "txt": "لِلْغَايَةِ",
   "fixes": []
  },
  {
   "id": "p033w013",
   "raw": "لا",
   "txt": "لاَ",
   "fixes": []
  },
  {
   "id": "p033w014",
   "raw": "يمكن",
   "txt": "يُمْكِنُ",
   "fixes": []
  },
  {
   "id": "p033w015",
   "raw": "رؤيْنُها",
   "txt": "رُؤْينُهَا",
   "fixes": []
  },
  {
   "id": "p033w016",
   "raw": "إلا",
   "txt": "إِلاَّ",
   "fixes": []
  },
  {
   "id": "p033w017",
   "raw": "باستخدام",
   "txt": "بِاسْتِخْدَامِ",
   "fixes": []
  },
  {
   "id": "p033w018",
   "raw": "المجهـر،",
   "txt": "الْمُجْهِرِ،",
   "fixes": [
    "kashida"
   ]
  },
  {
   "id": "p033w019",
   "raw": "وقد",
   "txt": "وَقَدْ",
   "fixes": []
  },
  {
   "id": "p033w020",
   "raw": "تُسبِبُ",
   "txt": "تَسَبَّبَ",
   "fixes": []
  },
  {
   "id": "p033w021",
   "raw": "البكتيريا",
   "txt": "الْبَكْتِيرِيا",
   "fixes": []
  },
  {
   "id": "p033w022",
   "raw": "الأمراض",
   "txt": "الأَمْرَاضَ",
   "fixes": []
  },
  {
   "id": "p033w023",
   "raw": "للبشر.",
   "txt": "لِلْبَشَرِ.",
   "fixes": []
  },
  {
   "id": "p033w024",
   "raw": "المستنقع:",
   "txt": "الْمُسْتَنْقِعُ:",
   "fixes": []
  },
  {
   "id": "p033w025",
   "raw": "منطقةٌ",
   "txt": "مِنْطَقَةٌ",
   "fixes": []
  },
  {
   "id": "p033w026",
   "raw": "رطبةٌ",
   "txt": "رَطْبَةٌ",
   "fixes": []
  },
  {
   "id": "p033w027",
   "raw": "تنمو",
   "txt": "تَنْمُو",
   "fixes": []
  },
  {
   "id": "p033w028",
   "raw": "فيها",
   "txt": "فِيهَا",
   "fixes": []
  },
  {
   "id": "p033w029",
   "raw": "أنواعٌ",
   "txt": "أَنْوَاعٌ",
   "fixes": []
  },
  {
   "id": "p033w030",
   "raw": "معينةٌ",
   "txt": "مُعَيَّنَةٌ",
   "fixes": []
  },
  {
   "id": "p033w031",
   "raw": "من",
   "txt": "مِنْ",
   "fixes": []
  },
  {
   "id": "p033w032",
   "raw": "الطحالب،",
   "txt": "الطَّحَالِبِ،",
   "fixes": []
  },
  {
   "id": "p033w033",
   "raw": "وتُصَبِّ",
   "txt": "وَتُصُبُّ",
   "fixes": []
  },
  {
   "id": "p033w034",
   "raw": "النباتاتُ",
   "txt": "النَّبَاتَاتِ",
   "fixes": []
  },
  {
   "id": "p033w035",
   "raw": "الموجودةٌ",
   "txt": "الْمَوْجُودَةُ",
   "fixes": []
  },
  {
   "id": "p033w036",
   "raw": "في",
   "txt": "فِي",
   "fixes": []
  },
  {
   "id": "p033w037",
   "raw": "هذا",
   "txt": "هَذَا",
   "fixes": []
  },
  {
   "id": "p033w038",
   "raw": "المكان",
   "txt": "الْمَكَانِ",
   "fixes": []
  },
  {
   "id": "p033w039",
   "raw": "على",
   "txt": "عَلَى",
   "fixes": []
  },
  {
   "id": "p033w040",
   "raw": "البكتيريا",
   "txt": "الْبَكْتِيرِيَّا",
   "fixes": []
  },
  {
   "id": "p033w041",
   "raw": "أن",
   "txt": "أَنْ",
   "fixes": []
  },
  {
   "id": "p033w042",
   "raw": "تنمو",
   "txt": "تَنْمُوَ",
   "fixes": []
  },
  {
   "id": "p033w043",
   "raw": "وتزدهر.",
   "txt": "وَتَزْدَهِرَّ.",
   "fixes": []
  },
  {
   "id": "p033w044",
   "raw": "الحضارة:",
   "txt": "الْحَضَارَةُ:",
   "fixes": []
  },
  {
   "id": "p033w045",
   "raw": "نظامٌ",
   "txt": "نِظَامٌ",
   "fixes": []
  },
  {
   "id": "p033w046",
   "raw": "اجتماعيٌ",
   "txt": "اجْتِمَاعِيٌّ",
   "fixes": []
  },
  {
   "id": "p033w047",
   "raw": "يُعينُ",
   "txt": "يُعَيِّنُ",
   "fixes": []
  },
  {
   "id": "p033w048",
   "raw": "الإنسانَ",
   "txt": "الإِنْسَانَ",
   "fixes": []
  },
  {
   "id": "p033w049",
   "raw": "على",
   "txt": "عَلَى",
   "fixes": []
  },
  {
   "id": "p033w050",
   "raw": "زيادة",
   "txt": "زِيَادَةِ",
   "fixes": []
  },
  {
   "id": "p033w051",
   "raw": "إنتاجه",
   "txt": "إِنْتَاجِهِ",
   "fixes": []
  },
  {
   "id": "p033w052",
   "raw": "في",
   "txt": "فِي",
   "fixes": []
  },
  {
   "id": "p033w053",
   "raw": "كافة",
   "txt": "كَافَّةِ",
   "fixes": []
  },
  {
   "id": "p033w054",
   "raw": "المجالات.",
   "txt": "الْمَجَالاتِ.",
   "fixes": []
  },
  {
   "id": "p033w055",
   "raw": "التحنيط:",
   "txt": "التَّحْنِيطُ:",
   "fixes": []
  },
  {
   "id": "p033w056",
   "raw": "معالجةٌ",
   "txt": "مُعَالَجَةُ",
   "fixes": []
  },
  {
   "id": "p033w057",
   "raw": "جثمان",
   "txt": "جُثْمَانٍ",
   "fixes": []
  },
  {
   "id": "p033w058",
   "raw": "المتوفى",
   "txt": "الْمُتَوَفَّى",
   "fixes": []
  },
  {
   "id": "p033w059",
   "raw": "بطريقةٌ",
   "txt": "بِطَرِيقَةٍ",
   "fixes": []
  },
  {
   "id": "p033w060",
   "raw": "خاصةٌ",
   "txt": "خَاصَّةٍ",
   "fixes": []
  },
  {
   "id": "p033w061",
   "raw": "تمنعُه",
   "txt": "تَمْنَعُهُ",
   "fixes": []
  },
  {
   "id": "p033w062",
   "raw": "من",
   "txt": "مِنْ",
   "fixes": []
  },
  {
   "id": "p033w063",
   "raw": "التحلل.",
   "txt": "التَّحَلُّلِ.",
   "fixes": []
  }
 ],
 "tashkeel_engine": "arabic-diacritizer"
}