{
 "book": "شكرا يامى",
 "source_pdf": "شكرا يامى.pdf",
 "pdf_sha256_16": "122b52391ef55fac",
 "page": 3,
 "source": "ocr",
 "ocr_engine": "lighton/parse-v3",
 "box_level": "none",
 "diac_ratio": 0.762,
 "path": "keep",
 "status": "extracted",
 "tokens": [
  {
   "id": "p003w000",
   "raw": "تَبْنِي",
   "txt": "تَبْنِي",
   "fixes": []
  },
  {
   "id": "p003w001",
   "raw": "قُصُورًا",
   "txt": "قُصُورًا",
   "fixes": []
  },
  {
   "id": "p003w002",
   "raw": "وَقَلَاعًا",
   "txt": "وَقَلَاعًا",
   "fixes": []
  },
  {
   "id": "p003w003",
   "raw": "وَطُرْقًا",
   "txt": "وَطُرْقًا",
   "fixes": []
  },
  {
   "id": "p003w004",
   "raw": "وَبَوَّابَاتٍ،",
   "txt": "وَبَوَّابَاتٍ،",
   "fixes": []
  },
  {
   "id": "p003w005",
   "raw": "وَتَقْضِي",
   "txt": "وَتَقْضِي",
   "fixes": []
  },
  {
   "id": "p003w006",
   "raw": "مَعَهَا",
   "txt": "مَعَهَا",
   "fixes": []
  },
  {
   "id": "p003w007",
   "raw": "أَجْمَلَ",
   "txt": "أَجْمَلَ",
   "fixes": []
  },
  {
   "id": "p003w008",
   "raw": "الأَوْفَاتِ؛",
   "txt": "الأَوْفَاتِ؛",
   "fixes": []
  },
  {
   "id": "p003w009",
   "raw": "حَتَّى",
   "txt": "حَتَّى",
   "fixes": []
  },
  {
   "id": "p003w010",
   "raw": "أَهْدَتْهَا",
   "txt": "أَهْدَتْهَا",
   "fixes": []
  },
  {
   "id": "p003w011",
   "raw": "خَالَتُهَا",
   "txt": "خَالَتُهَا",
   "fixes": []
  },
  {
   "id": "p003w012",
   "raw": "فِي",
   "txt": "فِي",
   "fixes": []
  },
  {
   "id": "p003w013",
   "raw": "عِيدٍ",
   "txt": "عِيدٍ",
   "fixes": []
  },
  {
   "id": "p003w014",
   "raw": "مِيلَادِهَا",
   "txt": "مِيلَادِهَا",
   "fixes": []
  },
  {
   "id": "p003w015",
   "raw": "الأَخِيرِ",
   "txt": "الأَخِيرِ",
   "fixes": []
  },
  {
   "id": "p003w016",
   "raw": "أَيْ",
   "txt": "أَيْ",
   "fixes": []
  },
  {
   "id": "p003w017",
   "raw": "بَادَ؛",
   "txt": "بَادَ؛",
   "fixes": []
  },
  {
   "id": "p003w018",
   "raw": "وَمِنْ",
   "txt": "وَمِنْ",
   "fixes": []
  },
  {
   "id": "p003w019",
   "raw": "وَقْتِهَا",
   "txt": "وَقْتِهَا",
   "fixes": []
  },
  {
   "id": "p003w020",
   "raw": "تَغَيَّرْتُ",
   "txt": "تَغَيَّرْتُ",
   "fixes": []
  },
  {
   "id": "p003w021",
   "raw": "فَرْحُ.",
   "txt": "فَرْحُ.",
   "fixes": []
  }
 ]
}