{
 "book": "الكواكب",
 "source_pdf": "الكواكب.pdf",
 "pdf_sha256_16": "05ce3eb0ab2ee10b",
 "page": 3,
 "source": "pdf-text-layer",
 "diac_ratio": 0.783,
 "path": "keep",
 "status": "extracted",
 "tokens": [
  {
   "id": "p003w000",
   "raw": "،ِعِنْدَمَـا",
   "txt": "عِنْدَمَا",
   "fixes": [
    "kashida",
    "leading-punct"
   ],
   "box": [
    8.096,
    5.599,
    84.871,
    5.892
   ]
  },
  {
   "id": "p003w001",
   "raw": "أَخَـذَتِ",
   "txt": "أَخَذَتِ",
   "fixes": [
    "kashida"
   ],
   "box": [
    79.466,
    5.599,
    6.121,
    5.892
   ]
  },
  {
   "id": "p003w002",
   "raw": "السَّـمَاءُ",
   "txt": "السَّمَاءُ",
   "fixes": [
    "kashida"
   ],
   "box": [
    70.878,
    5.599,
    7.559,
    5.892
   ]
  },
  {
   "id": "p003w003",
   "raw": "تُظْلِـمُ",
   "txt": "تُظْلِمُ",
   "fixes": [
    "kashida"
   ],
   "box": [
    64.851,
    5.599,
    4.998,
    5.892
   ]
  },
  {
   "id": "p003w004",
   "raw": "شَـيْئًا",
   "txt": "شَيْئًا",
   "fixes": [
    "kashida"
   ],
   "box": [
    58.834,
    5.599,
    4.988,
    5.892
   ]
  },
  {
   "id": "p003w005",
   "raw": "فَشَـيْئًا،",
   "txt": "فَشَيْئًا،",
   "fixes": [
    "kashida"
   ],
   "box": [
    50.792,
    5.599,
    7.014,
    5.892
   ]
  },
  {
   "id": "p003w006",
   "raw": "بَـدَأَتْ",
   "txt": "بَدَأَتْ",
   "fixes": [
    "kashida"
   ],
   "box": [
    44.463,
    5.599,
    5.3,
    5.892
   ]
  },
  {
   "id": "p003w007",
   "raw": "تُظْهِـرُ",
   "txt": "تُظْهِرُ",
   "fixes": [
    "kashida"
   ],
   "box": [
    37.495,
    5.599,
    5.939,
    5.892
   ]
  },
  {
   "id": "p003w008",
   "raw": "الْمَزِيـدَ",
   "txt": "الْمَزِيدَ",
   "fixes": [
    "kashida"
   ],
   "box": [
    30.104,
    5.599,
    6.361,
    5.892
   ]
  },
  {
   "id": "p003w009",
   "raw": "وَالْمَزِيـدَ",
   "txt": "وَالْمَزِيدَ",
   "fixes": [
    "kashida"
   ],
   "box": [
    21.724,
    5.599,
    7.351,
    5.892
   ]
  },
  {
   "id": "p003w010",
   "raw": "مِـنَ",
   "txt": "مِنَ",
   "fixes": [
    "kashida"
   ],
   "box": [
    17.099,
    5.599,
    3.596,
    5.892
   ]
  },
  {
   "id": "p003w011",
   "raw": "النُّجُـوم",
   "txt": "النُّجُوم",
   "fixes": [
    "kashida"
   ],
   "box": [
    9.132,
    5.599,
    6.939,
    5.892
   ]
  },
  {
   "id": "p003w012",
   "raw": "ٍكَانَ",
   "txt": "كَانَ",
   "fixes": [
    "leading-punct"
   ],
   "box": [
    9.133,
    11.734,
    83.82,
    5.892
   ]
  },
  {
   "id": "p003w013",
   "raw": "بَعْضُهَـا",
   "txt": "بَعْضُهَا",
   "fixes": [
    "kashida"
   ],
   "box": [
    81.295,
    11.734,
    7.143,
    5.892
   ]
  },
  {
   "id": "p003w014",
   "raw": "لَمِعًـا،",
   "txt": "لَمِعًا،",
   "fixes": [
    "kashida"
   ],
   "box": [
    74.209,
    11.734,
    6.254,
    5.892
   ]
  },
  {
   "id": "p003w015",
   "raw": "وَبَعْضُهَـا",
   "txt": "وَبَعْضُهَا",
   "fixes": [
    "kashida"
   ],
   "box": [
    65.088,
    11.734,
    8.29,
    5.892
   ]
  },
  {
   "id": "p003w016",
   "raw": "الَْخَـرُ",
   "txt": "الأَخَرُ",
   "fixes": [
    "kashida",
    "dropped-hamza"
   ],
   "box": [
    58.33,
    11.734,
    5.929,
    5.892
   ]
  },
  {
   "id": "p003w017",
   "raw": "بَاهِتًـا،",
   "txt": "بَاهِتًا،",
   "fixes": [
    "kashida"
   ],
   "box": [
    51.293,
    11.734,
    6.206,
    5.892
   ]
  },
  {
   "id": "p003w018",
   "raw": "وَهُنَـاكَ",
   "txt": "وَهُنَاكَ",
   "fixes": [
    "kashida"
   ],
   "box": [
    44.191,
    11.734,
    6.27,
    5.892
   ]
  },
  {
   "id": "p003w019",
   "raw": "بَعْـضٌ",
   "txt": "بَعْضٌ",
   "fixes": [
    "kashida"
   ],
   "box": [
    37.498,
    11.734,
    5.862,
    5.892
   ]
  },
  {
   "id": "p003w020",
   "raw": "آَخَـرُ",
   "txt": "آَخَرُ",
   "fixes": [
    "kashida"
   ],
   "box": [
    32.235,
    11.734,
    4.433,
    5.892
   ]
  },
  {
   "id": "p003w021",
   "raw": "كَانَ",
   "txt": "كَانَ",
   "fixes": [],
   "box": [
    27.72,
    11.734,
    3.684,
    5.892
   ]
  },
  {
   "id": "p003w022",
   "raw": "لَمِعًا",
   "txt": "لَمِعًا",
   "fixes": [],
   "box": [
    22.035,
    11.734,
    4.854,
    5.892
   ]
  },
  {
   "id": "p003w023",
   "raw": "بِشَـكْلٍ",
   "txt": "بِشَكْلٍ",
   "fixes": [
    "kashida"
   ],
   "box": [
    15.355,
    11.734,
    5.848,
    5.892
   ]
  },
  {
   "id": "p003w024",
   "raw": "جَمِيل",
   "txt": "جَمِيل",
   "fixes": [],
   "box": [
    9.133,
    11.734,
    5.391,
    5.892
   ]
  },
  {
   "id": "p003w025",
   "raw": "تَمَارَا",
   "txt": "تَمَارَا",
   "fixes": [],
   "box": [
    88.529,
    17.869,
    4.436,
    5.892
   ]
  },
  {
   "id": "p003w026",
   "raw": "هَلْ",
   "txt": "هَلْ",
   "fixes": [],
   "box": [
    83.457,
    17.869,
    3.02,
    5.892
   ]
  },
  {
   "id": "p003w027",
   "raw": "تَعْرِفُ",
   "txt": "تَعْرِفُ",
   "fixes": [],
   "box": [
    76.89,
    17.869,
    5.528,
    5.892
   ]
  },
  {
   "id": "p003w028",
   "raw": "عَدَدَ",
   "txt": "عَدَدَ",
   "fixes": [],
   "box": [
    71.825,
    17.869,
    4.026,
    5.892
   ]
  },
  {
   "id": "p003w029",
   "raw": "النُّجُومِ",
   "txt": "النُّجُومِ",
   "fixes": [],
   "box": [
    64.27,
    17.869,
    6.515,
    5.892
   ]
  },
  {
   "id": "p003w030",
   "raw": "الْمَوْجُودَةِ",
   "txt": "الْمَوْجُودَةِ",
   "fixes": [],
   "box": [
    54.015,
    17.869,
    9.216,
    5.892
   ]
  },
  {
   "id": "p003w031",
   "raw": "يَا",
   "txt": "يَا",
   "fixes": [],
   "box": [
    51.316,
    17.869,
    1.659,
    5.892
   ]
  },
  {
   "id": "p003w032",
   "raw": "يُوسُفُ؟",
   "txt": "يُوسُفُ؟",
   "fixes": [],
   "box": [
    42.494,
    17.869,
    7.784,
    5.892
   ]
  },
  {
   "id": "p003w033",
   "raw": "ِّأَجَابَتِ",
   "txt": "أَجَابَتِ",
   "fixes": [
    "leading-punct"
   ],
   "box": [
    57.238,
    24.005,
    35.724,
    5.892
   ]
  },
  {
   "id": "p003w034",
   "raw": "الُْمُّ",
   "txt": "الأُمُّ",
   "fixes": [
    "dropped-hamza"
   ],
   "box": [
    82.218,
    24.005,
    3.492,
    5.892
   ]
  },
  {
   "id": "p003w035",
   "raw": "الَّتِي",
   "txt": "الَّتِي",
   "fixes": [],
   "box": [
    76.916,
    24.005,
    4.262,
    5.892
   ]
  },
  {
   "id": "p003w036",
   "raw": "انْضَمَّتْ",
   "txt": "انْضَمَّتْ",
   "fixes": [],
   "box": [
    68.258,
    24.005,
    7.62,
    5.892
   ]
  },
  {
   "id": "p003w037",
   "raw": "إِلَيْهِمْ",
   "txt": "إِلَيْهِمْ",
   "fixes": [],
   "box": [
    62.182,
    24.005,
    5.036,
    5.892
   ]
  },
  {
   "id": "p003w038",
   "raw": "لِلتَّو",
   "txt": "لِلتَّو",
   "fixes": [],
   "box": [
    57.238,
    24.005,
    3.905,
    5.892
   ]
  },
  {
   "id": "p003w039",
   "raw": "ْالُْمُّ",
   "txt": "الأُمُّ",
   "fixes": [
    "leading-punct",
    "dropped-hamza"
   ],
   "box": [
    14.361,
    30.14,
    78.593,
    5.892
   ]
  },
  {
   "id": "p003w040",
   "raw": "لَ",
   "txt": "لَ",
   "fixes": [],
   "box": [
    85.781,
    30.14,
    1.597,
    5.892
   ]
  },
  {
   "id": "p003w041",
   "raw": "يَا",
   "txt": "يَا",
   "fixes": [],
   "box": [
    83.085,
    30.14,
    1.656,
    5.892
   ]
  },
  {
   "id": "p003w042",
   "raw": "عَزِيزَتِي،",
   "txt": "عَزِيزَتِي،",
   "fixes": [],
   "box": [
    73.512,
    30.14,
    8.534,
    5.892
   ]
  },
  {
   "id": "p003w043",
   "raw": "فَهُنَاكَ",
   "txt": "فَهُنَاكَ",
   "fixes": [],
   "box": [
    66.561,
    30.14,
    5.911,
    5.892
   ]
  },
  {
   "id": "p003w044",
   "raw": "مَلَيِينُ",
   "txt": "مَلَيِينُ",
   "fixes": [],
   "box": [
    58.836,
    30.14,
    6.685,
    5.892
   ]
  },
  {
   "id": "p003w045",
   "raw": "الْمَلَيِينِ",
   "txt": "الْمَلَيِينِ",
   "fixes": [],
   "box": [
    49.633,
    30.14,
    8.164,
    5.892
   ]
  },
  {
   "id": "p003w046",
   "raw": "مِنَ",
   "txt": "مِنَ",
   "fixes": [],
   "box": [
    45.456,
    30.14,
    3.138,
    5.892
   ]
  },
  {
   "id": "p003w047",
   "raw": "النُّجُومِ،",
   "txt": "النُّجُومِ،",
   "fixes": [],
   "box": [
    36.856,
    30.14,
    7.561,
    5.892
   ]
  },
  {
   "id": "p003w048",
   "raw": "وَلَ",
   "txt": "وَلَ",
   "fixes": [],
   "box": [
    33.299,
    30.14,
    2.518,
    5.892
   ]
  },
  {
   "id": "p003w049",
   "raw": "أَحَدَ",
   "txt": "أَحَدَ",
   "fixes": [],
   "box": [
    28.705,
    30.14,
    3.554,
    5.892
   ]
  },
  {
   "id": "p003w050",
   "raw": "يَعْرِفُ",
   "txt": "يَعْرِفُ",
   "fixes": [],
   "box": [
    22.141,
    30.14,
    5.525,
    5.892
   ]
  },
  {
   "id": "p003w051",
   "raw": "عَدَدَهُم",
   "txt": "عَدَدَهُم",
   "fixes": [],
   "box": [
    14.361,
    30.14,
    6.741,
    5.892
   ]
  },
  {
   "id": "p003w052",
   "raw": "،ِيُوسُفُ",
   "txt": "يُوسُفُ",
   "fixes": [
    "leading-punct"
   ],
   "box": [
    49.827,
    36.275,
    43.141,
    5.892
   ]
  },
  {
   "id": "p003w053",
   "raw": "أَنَا",
   "txt": "أَنَا",
   "fixes": [],
   "box": [
    81.893,
    36.275,
    2.374,
    5.892
   ]
  },
  {
   "id": "p003w054",
   "raw": "أَعْرِفُ",
   "txt": "أَعْرِفُ",
   "fixes": [],
   "box": [
    74.912,
    36.275,
    5.941,
    5.892
   ]
  },
  {
   "id": "p003w055",
   "raw": "عَدَدَ",
   "txt": "عَدَدَ",
   "fixes": [],
   "box": [
    69.847,
    36.275,
    4.026,
    5.892
   ]
  },
  {
   "id": "p003w056",
   "raw": "الْكَوَاكِبِ",
   "txt": "الْكَوَاكِبِ",
   "fixes": [],
   "box": [
    61.126,
    36.275,
    7.682,
    5.892
   ]
  },
  {
   "id": "p003w057",
   "raw": "الْمَوْجُودَة",
   "txt": "الْمَوْجُودَة",
   "fixes": [],
   "box": [
    50.873,
    36.275,
    9.213,
    5.892
   ]
  }
 ]
}