{
 "book": "المومياوات ناشيونال جيوجرافيك",
 "source_pdf": "المومياوات ناشيونال جيوجرافيك .pdf",
 "pdf_sha256_16": "a77d3a1ae7f90b76",
 "page": 8,
 "source": "ocr",
 "ocr_engine": "lighton/parse-v3",
 "box_level": "none",
 "diac_ratio": 0.749,
 "path": "keep",
 "status": "extracted",
 "tokens": [
  {
   "id": "p008w000",
   "raw": "المُومِيَاءُ",
   "txt": "المُومِيَاءُ",
   "fixes": []
  },
  {
   "id": "p008w001",
   "raw": "المُومِيَاءُ",
   "txt": "المُومِيَاءُ",
   "fixes": []
  },
  {
   "id": "p008w002",
   "raw": "هي",
   "txt": "هي",
   "fixes": []
  },
  {
   "id": "p008w003",
   "raw": "جُثَّةٌ",
   "txt": "جُثَّةٌ",
   "fixes": []
  },
  {
   "id": "p008w004",
   "raw": "لِمْ",
   "txt": "لِمْ",
   "fixes": []
  },
  {
   "id": "p008w005",
   "raw": "تتحلل.",
   "txt": "تتحلل.",
   "fixes": []
  },
  {
   "id": "p008w006",
   "raw": "وَتُوجِدُ",
   "txt": "وَتُوجِدُ",
   "fixes": []
  },
  {
   "id": "p008w007",
   "raw": "ظَرِيقَتَانِ",
   "txt": "ظَرِيقَتَانِ",
   "fixes": []
  },
  {
   "id": "p008w008",
   "raw": "لِتَحْنِيظِ",
   "txt": "لِتَحْنِيظِ",
   "fixes": []
  },
  {
   "id": "p008w009",
   "raw": "المُومِيَاءِ.",
   "txt": "المُومِيَاءِ.",
   "fixes": []
  },
  {
   "id": "p008w010",
   "raw": "فِيمَكِنْ",
   "txt": "فِيمَكِنْ",
   "fixes": []
  },
  {
   "id": "p008w011",
   "raw": "أَنْ",
   "txt": "أَنْ",
   "fixes": []
  },
  {
   "id": "p008w012",
   "raw": "يَسْتَخْدِمَ",
   "txt": "يَسْتَخْدِمَ",
   "fixes": []
  },
  {
   "id": "p008w013",
   "raw": "البَشَرُ",
   "txt": "البَشَرُ",
   "fixes": []
  },
  {
   "id": "p008w014",
   "raw": "مَوَادٌ",
   "txt": "مَوَادٌ",
   "fixes": []
  },
  {
   "id": "p008w015",
   "raw": "كِيمِيَائِيَّةٌ",
   "txt": "كِيمِيَائِيَّةٌ",
   "fixes": []
  },
  {
   "id": "p008w016",
   "raw": "قَاتِلَةٌ",
   "txt": "قَاتِلَةٌ",
   "fixes": []
  },
  {
   "id": "p008w017",
   "raw": "لِلْبَكْتِيرِيَا",
   "txt": "لِلْبَكْتِيرِيَا",
   "fixes": []
  },
  {
   "id": "p008w018",
   "raw": "فِي",
   "txt": "فِي",
   "fixes": []
  },
  {
   "id": "p008w019",
   "raw": "تَحْنِيظِ",
   "txt": "تَحْنِيظِ",
   "fixes": []
  },
  {
   "id": "p008w020",
   "raw": "الأَجْسَامِ.",
   "txt": "الأَجْسَامِ.",
   "fixes": []
  },
  {
   "id": "p008w021",
   "raw": "كَذَلِكَ",
   "txt": "كَذَلِكَ",
   "fixes": []
  },
  {
   "id": "p008w022",
   "raw": "قَدْ",
   "txt": "قَدْ",
   "fixes": []
  },
  {
   "id": "p008w023",
   "raw": "تَتَحَوَّلُ",
   "txt": "تَتَحَوَّلُ",
   "fixes": []
  },
  {
   "id": "p008w024",
   "raw": "الجَثَّةُ",
   "txt": "الجَثَّةُ",
   "fixes": []
  },
  {
   "id": "p008w025",
   "raw": "إِلَى",
   "txt": "إِلَى",
   "fixes": []
  },
  {
   "id": "p008w026",
   "raw": "مُومِيَاءٍ",
   "txt": "مُومِيَاءٍ",
   "fixes": []
  },
  {
   "id": "p008w027",
   "raw": "بِطَرِيقَةٍ",
   "txt": "بِطَرِيقَةٍ",
   "fixes": []
  },
  {
   "id": "p008w028",
   "raw": "طَبِيعِيَّةٍ",
   "txt": "طَبِيعِيَّةٍ",
   "fixes": []
  },
  {
   "id": "p008w029",
   "raw": "إِذَا",
   "txt": "إِذَا",
   "fixes": []
  },
  {
   "id": "p008w030",
   "raw": "وُجِدَتْ",
   "txt": "وُجِدَتْ",
   "fixes": []
  },
  {
   "id": "p008w031",
   "raw": "فِي",
   "txt": "فِي",
   "fixes": []
  },
  {
   "id": "p008w032",
   "raw": "المَكَانِ",
   "txt": "المَكَانِ",
   "fixes": []
  },
  {
   "id": "p008w033",
   "raw": "وَالْوَقْتِ",
   "txt": "وَالْوَقْتِ",
   "fixes": []
  },
  {
   "id": "p008w034",
   "raw": "المَنَاسِبِينِ.",
   "txt": "المَنَاسِبِينِ.",
   "fixes": []
  },
  {
   "id": "p008w035",
   "raw": "وَفِي",
   "txt": "وَفِي",
   "fixes": []
  },
  {
   "id": "p008w036",
   "raw": "مَثَلِ",
   "txt": "مَثَلِ",
   "fixes": []
  },
  {
   "id": "p008w037",
   "raw": "هَذِهِ",
   "txt": "هَذِهِ",
   "fixes": []
  },
  {
   "id": "p008w038",
   "raw": "الأَمَاكِنِ",
   "txt": "الأَمَاكِنِ",
   "fixes": []
  },
  {
   "id": "p008w039",
   "raw": "تَتَحَوَّلُ",
   "txt": "تَتَحَوَّلُ",
   "fixes": []
  },
  {
   "id": "p008w040",
   "raw": "جَثَّةُ",
   "txt": "جَثَّةُ",
   "fixes": []
  },
  {
   "id": "p008w041",
   "raw": "أَيْ",
   "txt": "أَيْ",
   "fixes": []
  },
  {
   "id": "p008w042",
   "raw": "كَائِنٍ",
   "txt": "كَائِنٍ",
   "fixes": []
  },
  {
   "id": "p008w043",
   "raw": "حَيٍّ",
   "txt": "حَيٍّ",
   "fixes": []
  },
  {
   "id": "p008w044",
   "raw": "يَمُوتُ",
   "txt": "يَمُوتُ",
   "fixes": []
  },
  {
   "id": "p008w045",
   "raw": "إِلَى",
   "txt": "إِلَى",
   "fixes": []
  },
  {
   "id": "p008w046",
   "raw": "مُومِيَاءٍ!",
   "txt": "مُومِيَاءٍ!",
   "fixes": []
  },
  {
   "id": "p008w047",
   "raw": "مصطلَدَاتٍ",
   "txt": "مصطلَدَاتٍ",
   "fixes": []
  },
  {
   "id": "p008w048",
   "raw": "عن",
   "txt": "عن",
   "fixes": []
  },
  {
   "id": "p008w049",
   "raw": "المُومِيَاءَ",
   "txt": "المُومِيَاءَ",
   "fixes": []
  },
  {
   "id": "p008w050",
   "raw": "**بَكْتِيرِيَا**:",
   "txt": "بَكْتِيرِيَا**:",
   "fixes": [
    "leading-punct"
   ]
  },
  {
   "id": "p008w051",
   "raw": "هي",
   "txt": "هي",
   "fixes": []
  },
  {
   "id": "p008w052",
   "raw": "كَائِنَاتٌ",
   "txt": "كَائِنَاتٌ",
   "fixes": []
  },
  {
   "id": "p008w053",
   "raw": "حِيَّةٌ",
   "txt": "حِيَّةٌ",
   "fixes": []
  },
  {
   "id": "p008w054",
   "raw": "صَغِيرَةٌ",
   "txt": "صَغِيرَةٌ",
   "fixes": []
  },
  {
   "id": "p008w055",
   "raw": "لِلْغَايَةِ",
   "txt": "لِلْغَايَةِ",
   "fixes": []
  },
  {
   "id": "p008w056",
   "raw": "لَا",
   "txt": "لَا",
   "fixes": []
  },
  {
   "id": "p008w057",
   "raw": "يُمْكِنُ",
   "txt": "يُمْكِنُ",
   "fixes": []
  },
  {
   "id": "p008w058",
   "raw": "رُؤْيُتُهَا",
   "txt": "رُؤْيُتُهَا",
   "fixes": []
  },
  {
   "id": "p008w059",
   "raw": "إِلَّا",
   "txt": "إِلَّا",
   "fixes": []
  },
  {
   "id": "p008w060",
   "raw": "بِاسْتِخْدَامِ",
   "txt": "بِاسْتِخْدَامِ",
   "fixes": []
  },
  {
   "id": "p008w061",
   "raw": "المَجْهَرِ.",
   "txt": "المَجْهَرِ.",
   "fixes": []
  },
  {
   "id": "p008w062",
   "raw": "**خَلَلٌ**:",
   "txt": "خَلَلٌ**:",
   "fixes": [
    "leading-punct"
   ]
  },
  {
   "id": "p008w063",
   "raw": "يَعِنِّي",
   "txt": "يَعِنِّي",
   "fixes": []
  },
  {
   "id": "p008w064",
   "raw": "التَّعْقُنَ",
   "txt": "التَّعْقُنَ",
   "fixes": []
  },
  {
   "id": "p008w065",
   "raw": "أَوِ",
   "txt": "أَوِ",
   "fixes": []
  },
  {
   "id": "p008w066",
   "raw": "التَّلْفَ.",
   "txt": "التَّلْفَ.",
   "fixes": []
  },
  {
   "id": "p008w067",
   "raw": "**٧**",
   "txt": "٧**",
   "fixes": [
    "leading-punct"
   ]
  },
  {
   "id": "p008w068",
   "raw": "**٧**",
   "txt": "٧**",
   "fixes": [
    "leading-punct"
   ]
  }
 ]
}