{
 "book": "المومياوات ناشيونال جيوجرافيك",
 "source_pdf": "المومياوات ناشيونال جيوجرافيك .pdf",
 "pdf_sha256_16": "a77d3a1ae7f90b76",
 "page": 30,
 "source": "ocr",
 "ocr_engine": "lighton/parse-v3",
 "box_level": "none",
 "diac_ratio": 0.0,
 "path": "diacritise",
 "status": "skipped-empty",
 "tokens": [],
 "tashkeel_engine": "arabic-diacritizer"
}