{
 "book": "المومياوات ناشيونال جيوجرافيك",
 "source_pdf": "المومياوات ناشيونال جيوجرافيك .pdf",
 "pdf_sha256_16": "a77d3a1ae7f90b76",
 "page": 23,
 "source": "ocr",
 "ocr_engine": "lighton/parse-v3",
 "box_level": "none",
 "diac_ratio": 0.023,
 "path": "diacritise",
 "status": "extracted",
 "tokens": [
  {
   "id": "p023w000",
   "raw": "لعنة",
   "txt": "لعنة",
   "fixes": []
  },
  {
   "id": "p023w001",
   "raw": "المعمّاء",
   "txt": "المعمّاء",
   "fixes": []
  },
  {
   "id": "p023w002",
   "raw": "هاورد",
   "txt": "هاورد",
   "fixes": []
  },
  {
   "id": "p023w003",
   "raw": "كارتر",
   "txt": "كارتر",
   "fixes": []
  },
  {
   "id": "p023w004",
   "raw": "في",
   "txt": "في",
   "fixes": []
  },
  {
   "id": "p023w005",
   "raw": "مقبرة",
   "txt": "مقبرة",
   "fixes": []
  },
  {
   "id": "p023w006",
   "raw": "الملك",
   "txt": "الملك",
   "fixes": []
  },
  {
   "id": "p023w007",
   "raw": "توت",
   "txt": "توت",
   "fixes": []
  },
  {
   "id": "p023w008",
   "raw": "عنخ",
   "txt": "عنخ",
   "fixes": []
  },
  {
   "id": "p023w009",
   "raw": "آمون",
   "txt": "آمون",
   "fixes": []
  }
 ]
}