{
 "book": "المومياوات ناشيونال جيوجرافيك",
 "source_pdf": "المومياوات ناشيونال جيوجرافيك .pdf",
 "pdf_sha256_16": "a77d3a1ae7f90b76",
 "page": 2,
 "source": "ocr",
 "ocr_engine": "lighton/parse-v3",
 "box_level": "none",
 "diac_ratio": 0.0,
 "path": "diacritise",
 "status": "extracted",
 "tokens": [
  {
   "id": "p002w000",
   "raw": "البحوث",
   "txt": "البحوث",
   "fixes": []
  },
  {
   "id": "p002w001",
   "raw": "البحوث",
   "txt": "البحوث",
   "fixes": []
  },
  {
   "id": "p002w002",
   "raw": "كارني",
   "txt": "كارني",
   "fixes": []
  },
  {
   "id": "p002w003",
   "raw": "NATIONAL",
   "txt": "NATIONAL",
   "fixes": []
  },
  {
   "id": "p002w004",
   "raw": "GEOGRAPHIC",
   "txt": "GEOGRAPHIC",
   "fixes": []
  }
 ]
}