{
 "book": "المومياوات ناشيونال جيوجرافيك",
 "source_pdf": "المومياوات ناشيونال جيوجرافيك .pdf",
 "pdf_sha256_16": "a77d3a1ae7f90b76",
 "page": 22,
 "source": "ocr",
 "ocr_engine": "lighton/parse-v3",
 "box_level": "none",
 "diac_ratio": 0.029,
 "path": "diacritise",
 "status": "extracted",
 "tokens": [
  {
   "id": "p022w000",
   "raw": "لقد",
   "txt": "لقد",
   "fixes": []
  },
  {
   "id": "p022w001",
   "raw": "عثر",
   "txt": "عثر",
   "fixes": []
  },
  {
   "id": "p022w002",
   "raw": "كارتر",
   "txt": "كارتر",
   "fixes": []
  },
  {
   "id": "p022w003",
   "raw": "على",
   "txt": "على",
   "fixes": []
  },
  {
   "id": "p022w004",
   "raw": "مقبرة",
   "txt": "مقبرة",
   "fixes": []
  },
  {
   "id": "p022w005",
   "raw": "توت",
   "txt": "توت",
   "fixes": []
  },
  {
   "id": "p022w006",
   "raw": "عنخ",
   "txt": "عنخ",
   "fixes": []
  },
  {
   "id": "p022w007",
   "raw": "آمون!",
   "txt": "آمون!",
   "fixes": []
  },
  {
   "id": "p022w008",
   "raw": "توفّي",
   "txt": "توفّي",
   "fixes": []
  },
  {
   "id": "p022w009",
   "raw": "الملك",
   "txt": "الملك",
   "fixes": []
  },
  {
   "id": "p022w010",
   "raw": "توت",
   "txt": "توت",
   "fixes": []
  },
  {
   "id": "p022w011",
   "raw": "منذ",
   "txt": "منذ",
   "fixes": []
  },
  {
   "id": "p022w012",
   "raw": "أكثر",
   "txt": "أكثر",
   "fixes": []
  },
  {
   "id": "p022w013",
   "raw": "من",
   "txt": "من",
   "fixes": []
  },
  {
   "id": "p022w014",
   "raw": "3300",
   "txt": "3300",
   "fixes": []
  },
  {
   "id": "p022w015",
   "raw": "عام،",
   "txt": "عام،",
   "fixes": []
  },
  {
   "id": "p022w016",
   "raw": "وكان",
   "txt": "وكان",
   "fixes": []
  },
  {
   "id": "p022w017",
   "raw": "في",
   "txt": "في",
   "fixes": []
  },
  {
   "id": "p022w018",
   "raw": "الثامنة",
   "txt": "الثامنة",
   "fixes": []
  },
  {
   "id": "p022w019",
   "raw": "عشرة",
   "txt": "عشرة",
   "fixes": []
  },
  {
   "id": "p022w020",
   "raw": "فقط",
   "txt": "فقط",
   "fixes": []
  },
  {
   "id": "p022w021",
   "raw": "من",
   "txt": "من",
   "fixes": []
  },
  {
   "id": "p022w022",
   "raw": "عمره.",
   "txt": "عمره.",
   "fixes": []
  },
  {
   "id": "p022w023",
   "raw": "ومع",
   "txt": "ومع",
   "fixes": []
  },
  {
   "id": "p022w024",
   "raw": "ذلك،",
   "txt": "ذلك،",
   "fixes": []
  },
  {
   "id": "p022w025",
   "raw": "ذفن",
   "txt": "ذفن",
   "fixes": []
  },
  {
   "id": "p022w026",
   "raw": "هذا",
   "txt": "هذا",
   "fixes": []
  },
  {
   "id": "p022w027",
   "raw": "الملك",
   "txt": "الملك",
   "fixes": []
  },
  {
   "id": "p022w028",
   "raw": "الشاب",
   "txt": "الشاب",
   "fixes": []
  },
  {
   "id": "p022w029",
   "raw": "ومعه",
   "txt": "ومعه",
   "fixes": []
  },
  {
   "id": "p022w030",
   "raw": "كنوزّ",
   "txt": "كنوزّ",
   "fixes": []
  },
  {
   "id": "p022w031",
   "raw": "لا",
   "txt": "لا",
   "fixes": []
  },
  {
   "id": "p022w032",
   "raw": "تقدّز",
   "txt": "تقدّز",
   "fixes": []
  },
  {
   "id": "p022w033",
   "raw": "بثمن.",
   "txt": "بثمن.",
   "fixes": []
  },
  {
   "id": "p022w034",
   "raw": "وقد",
   "txt": "وقد",
   "fixes": []
  },
  {
   "id": "p022w035",
   "raw": "جعلت",
   "txt": "جعلت",
   "fixes": []
  },
  {
   "id": "p022w036",
   "raw": "هذه",
   "txt": "هذه",
   "fixes": []
  },
  {
   "id": "p022w037",
   "raw": "المقبرة",
   "txt": "المقبرة",
   "fixes": []
  },
  {
   "id": "p022w038",
   "raw": "الملك",
   "txt": "الملك",
   "fixes": []
  },
  {
   "id": "p022w039",
   "raw": "توت",
   "txt": "توت",
   "fixes": []
  },
  {
   "id": "p022w040",
   "raw": "أشهر",
   "txt": "أشهر",
   "fixes": []
  },
  {
   "id": "p022w041",
   "raw": "مومياء",
   "txt": "مومياء",
   "fixes": []
  },
  {
   "id": "p022w042",
   "raw": "في",
   "txt": "في",
   "fixes": []
  },
  {
   "id": "p022w043",
   "raw": "العالم.",
   "txt": "العالم.",
   "fixes": []
  },
  {
   "id": "p022w044",
   "raw": "المذكرة",
   "txt": "المذكرة",
   "fixes": []
  },
  {
   "id": "p022w045",
   "raw": "المصطلحات",
   "txt": "المصطلحات",
   "fixes": []
  },
  {
   "id": "p022w046",
   "raw": "عن",
   "txt": "عن",
   "fixes": []
  },
  {
   "id": "p022w047",
   "raw": "الملك",
   "txt": "الملك",
   "fixes": []
  },
  {
   "id": "p022w048",
   "raw": "المومياءات",
   "txt": "المومياءات",
   "fixes": []
  },
  {
   "id": "p022w049",
   "raw": "**مقبرة**:",
   "txt": "مقبرة**:",
   "fixes": [
    "leading-punct"
   ]
  },
  {
   "id": "p022w050",
   "raw": "تعني",
   "txt": "تعني",
   "fixes": []
  },
  {
   "id": "p022w051",
   "raw": "قبرّاً.",
   "txt": "قبرّاً.",
   "fixes": []
  },
  {
   "id": "p022w052",
   "raw": "وهي",
   "txt": "وهي",
   "fixes": []
  },
  {
   "id": "p022w053",
   "raw": "عبارة",
   "txt": "عبارة",
   "fixes": []
  },
  {
   "id": "p022w054",
   "raw": "عن",
   "txt": "عن",
   "fixes": []
  },
  {
   "id": "p022w055",
   "raw": "حُجرة",
   "txt": "حُجرة",
   "fixes": []
  },
  {
   "id": "p022w056",
   "raw": "أو",
   "txt": "أو",
   "fixes": []
  },
  {
   "id": "p022w057",
   "raw": "بناء",
   "txt": "بناء",
   "fixes": []
  },
  {
   "id": "p022w058",
   "raw": "لدفن",
   "txt": "لدفن",
   "fixes": []
  },
  {
   "id": "p022w059",
   "raw": "المتوقّى.",
   "txt": "المتوقّى.",
   "fixes": []
  }
 ]
}