{
 "book": "المومياوات ناشيونال جيوجرافيك",
 "source_pdf": "المومياوات ناشيونال جيوجرافيك .pdf",
 "pdf_sha256_16": "a77d3a1ae7f90b76",
 "page": 27,
 "source": "ocr",
 "ocr_engine": "lighton/parse-v3",
 "box_level": "none",
 "diac_ratio": 0.114,
 "path": "diacritise",
 "status": "extracted",
 "tokens": [
  {
   "id": "p027w000",
   "raw": "مملاً",
   "txt": "مملاً",
   "fixes": []
  },
  {
   "id": "p027w001",
   "raw": "السيدة",
   "txt": "السيدة",
   "fixes": []
  },
  {
   "id": "p027w002",
   "raw": "الأميل",
   "txt": "الأميل",
   "fixes": []
  },
  {
   "id": "p027w003",
   "raw": "منذٌ",
   "txt": "منذٌ",
   "fixes": []
  },
  {
   "id": "p027w004",
   "raw": "أكثر",
   "txt": "أكثر",
   "fixes": []
  },
  {
   "id": "p027w005",
   "raw": "من",
   "txt": "من",
   "fixes": []
  },
  {
   "id": "p027w006",
   "raw": "ألفي",
   "txt": "ألفي",
   "fixes": []
  },
  {
   "id": "p027w007",
   "raw": "سنةٌ",
   "txt": "سنةٌ",
   "fixes": []
  },
  {
   "id": "p027w008",
   "raw": "تُوفيت",
   "txt": "تُوفيت",
   "fixes": []
  },
  {
   "id": "p027w009",
   "raw": "سيدةٌ",
   "txt": "سيدةٌ",
   "fixes": []
  },
  {
   "id": "p027w010",
   "raw": "صينيةٌ",
   "txt": "صينيةٌ",
   "fixes": []
  },
  {
   "id": "p027w011",
   "raw": "غنيةٌ",
   "txt": "غنيةٌ",
   "fixes": []
  },
  {
   "id": "p027w012",
   "raw": "عُرفت",
   "txt": "عُرفت",
   "fixes": []
  },
  {
   "id": "p027w013",
   "raw": "باسم",
   "txt": "باسم",
   "fixes": []
  },
  {
   "id": "p027w014",
   "raw": "السيدة",
   "txt": "السيدة",
   "fixes": []
  },
  {
   "id": "p027w015",
   "raw": "«داي».",
   "txt": "داي».",
   "fixes": [
    "leading-punct"
   ]
  },
  {
   "id": "p027w016",
   "raw": "حُفظت",
   "txt": "حُفظت",
   "fixes": []
  },
  {
   "id": "p027w017",
   "raw": "جثةُ",
   "txt": "جثةُ",
   "fixes": []
  },
  {
   "id": "p027w018",
   "raw": "السيدة",
   "txt": "السيدة",
   "fixes": []
  },
  {
   "id": "p027w019",
   "raw": "«داي»",
   "txt": "داي»",
   "fixes": [
    "leading-punct"
   ]
  },
  {
   "id": "p027w020",
   "raw": "باستخدام",
   "txt": "باستخدام",
   "fixes": []
  },
  {
   "id": "p027w021",
   "raw": "الملح؛",
   "txt": "الملح؛",
   "fixes": []
  },
  {
   "id": "p027w022",
   "raw": "وذلك",
   "txt": "وذلك",
   "fixes": []
  },
  {
   "id": "p027w023",
   "raw": "لأنَّه",
   "txt": "لأنَّه",
   "fixes": []
  },
  {
   "id": "p027w024",
   "raw": "يمتضّ",
   "txt": "يمتضّ",
   "fixes": []
  },
  {
   "id": "p027w025",
   "raw": "الماءَ",
   "txt": "الماءَ",
   "fixes": []
  },
  {
   "id": "p027w026",
   "raw": "من",
   "txt": "من",
   "fixes": []
  },
  {
   "id": "p027w027",
   "raw": "الجثة،",
   "txt": "الجثة،",
   "fixes": []
  },
  {
   "id": "p027w028",
   "raw": "مما",
   "txt": "مما",
   "fixes": []
  },
  {
   "id": "p027w029",
   "raw": "يمتنّعها",
   "txt": "يمتنّعها",
   "fixes": []
  },
  {
   "id": "p027w030",
   "raw": "من",
   "txt": "من",
   "fixes": []
  },
  {
   "id": "p027w031",
   "raw": "التعقّن.",
   "txt": "التعقّن.",
   "fixes": []
  },
  {
   "id": "p027w032",
   "raw": "وقد",
   "txt": "وقد",
   "fixes": []
  },
  {
   "id": "p027w033",
   "raw": "كان",
   "txt": "كان",
   "fixes": []
  },
  {
   "id": "p027w034",
   "raw": "الجثمانُ",
   "txt": "الجثمانُ",
   "fixes": []
  },
  {
   "id": "p027w035",
   "raw": "ملفوفًا",
   "txt": "ملفوفًا",
   "fixes": []
  },
  {
   "id": "p027w036",
   "raw": "في",
   "txt": "في",
   "fixes": []
  },
  {
   "id": "p027w037",
   "raw": "20",
   "txt": "20",
   "fixes": []
  },
  {
   "id": "p027w038",
   "raw": "طبقةٌ",
   "txt": "طبقةٌ",
   "fixes": []
  },
  {
   "id": "p027w039",
   "raw": "من",
   "txt": "من",
   "fixes": []
  },
  {
   "id": "p027w040",
   "raw": "الحرير.",
   "txt": "الحرير.",
   "fixes": []
  },
  {
   "id": "p027w041",
   "raw": "وُضع",
   "txt": "وُضع",
   "fixes": []
  },
  {
   "id": "p027w042",
   "raw": "جثمانُ",
   "txt": "جثمانُ",
   "fixes": []
  },
  {
   "id": "p027w043",
   "raw": "السيدة",
   "txt": "السيدة",
   "fixes": []
  },
  {
   "id": "p027w044",
   "raw": "«داي»",
   "txt": "داي»",
   "fixes": [
    "leading-punct"
   ]
  },
  {
   "id": "p027w045",
   "raw": "داخل",
   "txt": "داخل",
   "fixes": []
  },
  {
   "id": "p027w046",
   "raw": "ستةٍ",
   "txt": "ستةٍ",
   "fixes": []
  },
  {
   "id": "p027w047",
   "raw": "توابيت",
   "txt": "توابيت",
   "fixes": []
  },
  {
   "id": "p027w048",
   "raw": "متداخلةٍ",
   "txt": "متداخلةٍ",
   "fixes": []
  },
  {
   "id": "p027w049",
   "raw": "مزخرفةٍ",
   "txt": "مزخرفةٍ",
   "fixes": []
  },
  {
   "id": "p027w050",
   "raw": "برسوماتٍ",
   "txt": "برسوماتٍ",
   "fixes": []
  },
  {
   "id": "p027w051",
   "raw": "رائعةٍ",
   "txt": "رائعةٍ",
   "fixes": []
  },
  {
   "id": "p027w052",
   "raw": "الجمال.",
   "txt": "الجمال.",
   "fixes": []
  },
  {
   "id": "p027w053",
   "raw": "وقد",
   "txt": "وقد",
   "fixes": []
  },
  {
   "id": "p027w054",
   "raw": "دفَّنها",
   "txt": "دفَّنها",
   "fixes": []
  },
  {
   "id": "p027w055",
   "raw": "عمالُ",
   "txt": "عمالُ",
   "fixes": []
  },
  {
   "id": "p027w056",
   "raw": "الدفن",
   "txt": "الدفن",
   "fixes": []
  },
  {
   "id": "p027w057",
   "raw": "في",
   "txt": "في",
   "fixes": []
  },
  {
   "id": "p027w058",
   "raw": "قاعٍ",
   "txt": "قاعٍ",
   "fixes": []
  },
  {
   "id": "p027w059",
   "raw": "نفقٍ",
   "txt": "نفقٍ",
   "fixes": []
  },
  {
   "id": "p027w060",
   "raw": "خُفر",
   "txt": "خُفر",
   "fixes": []
  },
  {
   "id": "p027w061",
   "raw": "على",
   "txt": "على",
   "fixes": []
  },
  {
   "id": "p027w062",
   "raw": "عمقٍ",
   "txt": "عمقٍ",
   "fixes": []
  },
  {
   "id": "p027w063",
   "raw": "كبيرٍ",
   "txt": "كبيرٍ",
   "fixes": []
  },
  {
   "id": "p027w064",
   "raw": "في",
   "txt": "في",
   "fixes": []
  },
  {
   "id": "p027w065",
   "raw": "الأرض.",
   "txt": "الأرض.",
   "fixes": []
  },
  {
   "id": "p027w066",
   "raw": "الشكل",
   "txt": "الشكل",
   "fixes": []
  },
  {
   "id": "p027w067",
   "raw": "المحتمل",
   "txt": "المحتمل",
   "fixes": []
  },
  {
   "id": "p027w068",
   "raw": "للسيدة",
   "txt": "للسيدة",
   "fixes": []
  },
  {
   "id": "p027w069",
   "raw": "«داي»",
   "txt": "داي»",
   "fixes": [
    "leading-punct"
   ]
  }
 ]
}