{
 "book": "المومياوات ناشيونال جيوجرافيك",
 "source_pdf": "المومياوات ناشيونال جيوجرافيك .pdf",
 "pdf_sha256_16": "a77d3a1ae7f90b76",
 "page": 19,
 "source": "ocr",
 "ocr_engine": "lighton/parse-v3",
 "box_level": "none",
 "diac_ratio": 0.026,
 "path": "diacritise",
 "status": "diacritised",
 "tokens": [
  {
   "id": "p019w000",
   "raw": "طريقة",
   "txt": "طَرِيقَةِ",
   "fixes": []
  },
  {
   "id": "p019w001",
   "raw": "التحنيط",
   "txt": "التَّحْنِيطِ",
   "fixes": []
  },
  {
   "id": "p019w002",
   "raw": "عند",
   "txt": "عِنْدَ",
   "fixes": []
  },
  {
   "id": "p019w003",
   "raw": "المصريين",
   "txt": "الْمِصْرِيِّينَ",
   "fixes": []
  },
  {
   "id": "p019w004",
   "raw": "الفدماي",
   "txt": "الْفِدَمَايِّ",
   "fixes": []
  },
  {
   "id": "p019w005",
   "raw": "يُزيل",
   "txt": "يُزِيلُ",
   "fixes": []
  },
  {
   "id": "p019w006",
   "raw": "العمال",
   "txt": "الْعُمَّالُ",
   "fixes": []
  },
  {
   "id": "p019w007",
   "raw": "من",
   "txt": "مِنَ",
   "fixes": []
  },
  {
   "id": "p019w008",
   "raw": "الجسير",
   "txt": "الْجَسِيرِ",
   "fixes": []
  },
  {
   "id": "p019w009",
   "raw": "أعضاء",
   "txt": "أَعْضَاءَ",
   "fixes": []
  },
  {
   "id": "p019w010",
   "raw": "مثل",
   "txt": "مِثْلِ",
   "fixes": []
  },
  {
   "id": "p019w011",
   "raw": "الرثتين",
   "txt": "الرِّثَّتَيْنِ",
   "fixes": []
  },
  {
   "id": "p019w012",
   "raw": "والكبد.",
   "txt": "وَالْكَبِدِ.",
   "fixes": []
  },
  {
   "id": "p019w013",
   "raw": "يُخرج",
   "txt": "يُخْرِجُ",
   "fixes": []
  },
  {
   "id": "p019w014",
   "raw": "عمال",
   "txt": "عُمَّالُ",
   "fixes": []
  },
  {
   "id": "p019w015",
   "raw": "التحنيط",
   "txt": "التَّحْنِيطِ",
   "fixes": []
  },
  {
   "id": "p019w016",
   "raw": "المخ",
   "txt": "الْمُخِّ",
   "fixes": []
  },
  {
   "id": "p019w017",
   "raw": "من",
   "txt": "مِنَ",
   "fixes": []
  },
  {
   "id": "p019w018",
   "raw": "الأنف",
   "txt": "الأَنْفِ",
   "fixes": []
  },
  {
   "id": "p019w019",
   "raw": "باستخدام",
   "txt": "بِاسْتِخْدَامِ",
   "fixes": []
  },
  {
   "id": "p019w020",
   "raw": "خُطافٍ",
   "txt": "خِطَّافٍ",
   "fixes": []
  },
  {
   "id": "p019w021",
   "raw": "كبير.",
   "txt": "كَبِيرٍ.",
   "fixes": []
  },
  {
   "id": "p019w022",
   "raw": "يغسل",
   "txt": "يُغَسِّلُ",
   "fixes": []
  },
  {
   "id": "p019w023",
   "raw": "العمال",
   "txt": "الْعُمَّالُ",
   "fixes": []
  },
  {
   "id": "p019w024",
   "raw": "الخثمأن",
   "txt": "الْخَثْمَأَنَّ",
   "fixes": []
  },
  {
   "id": "p019w025",
   "raw": "ويغطونه",
   "txt": "وَيُغَطُّونَهُ",
   "fixes": []
  },
  {
   "id": "p019w026",
   "raw": "بالملح.",
   "txt": "بِالْمِلْحِ.",
   "fixes": []
  },
  {
   "id": "p019w027",
   "raw": "**الرثتان**",
   "txt": "الرَّثَّتَانِ**",
   "fixes": [
    "leading-punct"
   ]
  },
  {
   "id": "p019w028",
   "raw": "**الكبد**",
   "txt": "الْكَبِدَ**",
   "fixes": [
    "leading-punct"
   ]
  }
 ],
 "tashkeel_engine": "arabic-diacritizer"
}