{
 "book": "شكرا يامى",
 "source_pdf": "شكرا يامى.pdf",
 "pdf_sha256_16": "122b52391ef55fac",
 "page": 8,
 "source": "ocr",
 "ocr_engine": "lighton/parse-v3",
 "box_level": "none",
 "diac_ratio": 0.836,
 "path": "keep",
 "status": "extracted",
 "tokens": [
  {
   "id": "p008w000",
   "raw": "وَفِي",
   "txt": "وَفِي",
   "fixes": []
  },
  {
   "id": "p008w001",
   "raw": "الْمُتَّجَرِ",
   "txt": "الْمُتَّجَرِ",
   "fixes": []
  },
  {
   "id": "p008w002",
   "raw": "اشْتَرَيْتُ",
   "txt": "اشْتَرَيْتُ",
   "fixes": []
  },
  {
   "id": "p008w003",
   "raw": "أَوْرَاقًا",
   "txt": "أَوْرَاقًا",
   "fixes": []
  },
  {
   "id": "p008w004",
   "raw": "مُلَوَّنَةً",
   "txt": "مُلَوَّنَةً",
   "fixes": []
  },
  {
   "id": "p008w005",
   "raw": "وَمِقَصَّا،",
   "txt": "وَمِقَصَّا،",
   "fixes": []
  },
  {
   "id": "p008w006",
   "raw": "وَصَلْصَالًا،",
   "txt": "وَصَلْصَالًا،",
   "fixes": []
  },
  {
   "id": "p008w007",
   "raw": "وَمَادَةً",
   "txt": "وَمَادَةً",
   "fixes": []
  },
  {
   "id": "p008w008",
   "raw": "لَاصِقَةً،",
   "txt": "لَاصِقَةً،",
   "fixes": []
  },
  {
   "id": "p008w009",
   "raw": "وَعُيُونًا",
   "txt": "وَعُيُونًا",
   "fixes": []
  },
  {
   "id": "p008w010",
   "raw": "بِلاشْتِيكِيَّةً",
   "txt": "بِلاشْتِيكِيَّةً",
   "fixes": []
  },
  {
   "id": "p008w011",
   "raw": "وَأَلْوَانًا،",
   "txt": "وَأَلْوَانًا،",
   "fixes": []
  },
  {
   "id": "p008w012",
   "raw": "وَمِنَ",
   "txt": "وَمِنَ",
   "fixes": []
  },
  {
   "id": "p008w013",
   "raw": "الْمَكْتَبَةِ",
   "txt": "الْمَكْتَبَةِ",
   "fixes": []
  },
  {
   "id": "p008w014",
   "raw": "اشْتَرَيْتُ",
   "txt": "اشْتَرَيْتُ",
   "fixes": []
  },
  {
   "id": "p008w015",
   "raw": "بَعْضَ",
   "txt": "بَعْضَ",
   "fixes": []
  },
  {
   "id": "p008w016",
   "raw": "الْقَصَصِ",
   "txt": "الْقَصَصِ",
   "fixes": []
  },
  {
   "id": "p008w017",
   "raw": "وَالْمَجَّلَاتِ،",
   "txt": "وَالْمَجَّلَاتِ،",
   "fixes": []
  },
  {
   "id": "p008w018",
   "raw": "وَبَعْدَ",
   "txt": "وَبَعْدَ",
   "fixes": []
  },
  {
   "id": "p008w019",
   "raw": "عَوْدَتِنَا",
   "txt": "عَوْدَتِنَا",
   "fixes": []
  },
  {
   "id": "p008w020",
   "raw": "إِلَى",
   "txt": "إِلَى",
   "fixes": []
  },
  {
   "id": "p008w021",
   "raw": "الْمُنْزِلِ",
   "txt": "الْمُنْزِلِ",
   "fixes": []
  },
  {
   "id": "p008w022",
   "raw": "قَرَأْنَا",
   "txt": "قَرَأْنَا",
   "fixes": []
  },
  {
   "id": "p008w023",
   "raw": "بَعْضَ",
   "txt": "بَعْضَ",
   "fixes": []
  },
  {
   "id": "p008w024",
   "raw": "الْقَصَصِ.",
   "txt": "الْقَصَصِ.",
   "fixes": []
  }
 ]
}