{
 "book": "المومياوات ناشيونال جيوجرافيك",
 "source_pdf": "المومياوات ناشيونال جيوجرافيك .pdf",
 "pdf_sha256_16": "a77d3a1ae7f90b76",
 "page": 5,
 "source": "ocr",
 "ocr_engine": "lighton/parse-v3",
 "box_level": "none",
 "diac_ratio": 0.088,
 "path": "diacritise",
 "status": "extracted",
 "tokens": [
  {
   "id": "p005w000",
   "raw": "العندوع",
   "txt": "العندوع",
   "fixes": []
  },
  {
   "id": "p005w001",
   "raw": "على",
   "txt": "على",
   "fixes": []
  },
  {
   "id": "p005w002",
   "raw": "مومياء!",
   "txt": "مومياء!",
   "fixes": []
  },
  {
   "id": "p005w003",
   "raw": "كان",
   "txt": "كان",
   "fixes": []
  },
  {
   "id": "p005w004",
   "raw": "أحدُ",
   "txt": "أحدُ",
   "fixes": []
  },
  {
   "id": "p005w005",
   "raw": "المزارعين",
   "txt": "المزارعين",
   "fixes": []
  },
  {
   "id": "p005w006",
   "raw": "يعمل",
   "txt": "يعمل",
   "fixes": []
  },
  {
   "id": "p005w007",
   "raw": "في",
   "txt": "في",
   "fixes": []
  },
  {
   "id": "p005w008",
   "raw": "أرض",
   "txt": "أرض",
   "fixes": []
  },
  {
   "id": "p005w009",
   "raw": "مُستنفعات،",
   "txt": "مُستنفعات،",
   "fixes": []
  },
  {
   "id": "p005w010",
   "raw": "ثمّ",
   "txt": "ثمّ",
   "fixes": []
  },
  {
   "id": "p005w011",
   "raw": "اصطدمت",
   "txt": "اصطدمت",
   "fixes": []
  },
  {
   "id": "p005w012",
   "raw": "مجرفته",
   "txt": "مجرفته",
   "fixes": []
  },
  {
   "id": "p005w013",
   "raw": "بشيءٍ",
   "txt": "بشيءٍ",
   "fixes": []
  },
  {
   "id": "p005w014",
   "raw": "صُلبٍ،",
   "txt": "صُلبٍ،",
   "fixes": []
  },
  {
   "id": "p005w015",
   "raw": "فأخريج",
   "txt": "فأخريج",
   "fixes": []
  },
  {
   "id": "p005w016",
   "raw": "جسداً",
   "txt": "جسداً",
   "fixes": []
  },
  {
   "id": "p005w017",
   "raw": "أسود",
   "txt": "أسود",
   "fixes": []
  },
  {
   "id": "p005w018",
   "raw": "اللون.",
   "txt": "اللون.",
   "fixes": []
  },
  {
   "id": "p005w019",
   "raw": "وُجَدَ",
   "txt": "وُجَدَ",
   "fixes": []
  },
  {
   "id": "p005w020",
   "raw": "أنّ",
   "txt": "أنّ",
   "fixes": []
  },
  {
   "id": "p005w021",
   "raw": "لهذا",
   "txt": "لهذا",
   "fixes": []
  },
  {
   "id": "p005w022",
   "raw": "الجسد",
   "txt": "الجسد",
   "fixes": []
  },
  {
   "id": "p005w023",
   "raw": "شعرًا،",
   "txt": "شعرًا،",
   "fixes": []
  },
  {
   "id": "p005w024",
   "raw": "وأسنانًا",
   "txt": "وأسنانًا",
   "fixes": []
  },
  {
   "id": "p005w025",
   "raw": "وحَتّى",
   "txt": "وحَتّى",
   "fixes": []
  },
  {
   "id": "p005w026",
   "raw": "بصمات",
   "txt": "بصمات",
   "fixes": []
  },
  {
   "id": "p005w027",
   "raw": "أصابع.",
   "txt": "أصابع.",
   "fixes": []
  },
  {
   "id": "p005w028",
   "raw": "اتصل",
   "txt": "اتصل",
   "fixes": []
  },
  {
   "id": "p005w029",
   "raw": "المزارع",
   "txt": "المزارع",
   "fixes": []
  },
  {
   "id": "p005w030",
   "raw": "بالشرطة",
   "txt": "بالشرطة",
   "fixes": []
  },
  {
   "id": "p005w031",
   "raw": "على",
   "txt": "على",
   "fixes": []
  },
  {
   "id": "p005w032",
   "raw": "الفور.",
   "txt": "الفور.",
   "fixes": []
  },
  {
   "id": "p005w033",
   "raw": "فقد",
   "txt": "فقد",
   "fixes": []
  },
  {
   "id": "p005w034",
   "raw": "بدا",
   "txt": "بدا",
   "fixes": []
  },
  {
   "id": "p005w035",
   "raw": "له",
   "txt": "له",
   "fixes": []
  },
  {
   "id": "p005w036",
   "raw": "هذا",
   "txt": "هذا",
   "fixes": []
  },
  {
   "id": "p005w037",
   "raw": "الإنسان",
   "txt": "الإنسان",
   "fixes": []
  },
  {
   "id": "p005w038",
   "raw": "قدّ",
   "txt": "قدّ",
   "fixes": []
  },
  {
   "id": "p005w039",
   "raw": "مات",
   "txt": "مات",
   "fixes": []
  },
  {
   "id": "p005w040",
   "raw": "في",
   "txt": "في",
   "fixes": []
  },
  {
   "id": "p005w041",
   "raw": "وقت",
   "txt": "وقت",
   "fixes": []
  },
  {
   "id": "p005w042",
   "raw": "قريب.",
   "txt": "قريب.",
   "fixes": []
  },
  {
   "id": "p005w043",
   "raw": "إلّا",
   "txt": "إلّا",
   "fixes": []
  },
  {
   "id": "p005w044",
   "raw": "أنّ",
   "txt": "أنّ",
   "fixes": []
  },
  {
   "id": "p005w045",
   "raw": "هذا",
   "txt": "هذا",
   "fixes": []
  },
  {
   "id": "p005w046",
   "raw": "الجثمان",
   "txt": "الجثمان",
   "fixes": []
  },
  {
   "id": "p005w047",
   "raw": "كان",
   "txt": "كان",
   "fixes": []
  },
  {
   "id": "p005w048",
   "raw": "لإنسانٍ",
   "txt": "لإنسانٍ",
   "fixes": []
  },
  {
   "id": "p005w049",
   "raw": "توفّي",
   "txt": "توفّي",
   "fixes": []
  },
  {
   "id": "p005w050",
   "raw": "منذ",
   "txt": "منذ",
   "fixes": []
  },
  {
   "id": "p005w051",
   "raw": "أكثر",
   "txt": "أكثر",
   "fixes": []
  },
  {
   "id": "p005w052",
   "raw": "من",
   "txt": "من",
   "fixes": []
  },
  {
   "id": "p005w053",
   "raw": "ألفي",
   "txt": "ألفي",
   "fixes": []
  },
  {
   "id": "p005w054",
   "raw": "عامٍ!",
   "txt": "عامٍ!",
   "fixes": []
  },
  {
   "id": "p005w055",
   "raw": "إنه",
   "txt": "إنه",
   "fixes": []
  },
  {
   "id": "p005w056",
   "raw": "مومياء!",
   "txt": "مومياء!",
   "fixes": []
  }
 ]
}