{
 "book": "المومياوات ناشيونال جيوجرافيك",
 "source_pdf": "المومياوات ناشيونال جيوجرافيك .pdf",
 "pdf_sha256_16": "a77d3a1ae7f90b76",
 "page": 16,
 "source": "ocr",
 "ocr_engine": "lighton/parse-v3",
 "box_level": "none",
 "diac_ratio": 0.041,
 "path": "diacritise",
 "status": "extracted",
 "tokens": [
  {
   "id": "p016w000",
   "raw": "٦٣٤٠",
   "txt": "٦٣٤٠",
   "fixes": []
  },
  {
   "id": "p016w001",
   "raw": "ج.",
   "txt": "ج.",
   "fixes": []
  },
  {
   "id": "p016w002",
   "raw": "م.",
   "txt": "م.",
   "fixes": []
  },
  {
   "id": "p016w003",
   "raw": "س.",
   "txt": "س.",
   "fixes": []
  },
  {
   "id": "p016w004",
   "raw": "٦٤٠٠٠",
   "txt": "٦٤٠٠٠",
   "fixes": []
  },
  {
   "id": "p016w005",
   "raw": "ج.",
   "txt": "ج.",
   "fixes": []
  },
  {
   "id": "p016w006",
   "raw": "س.",
   "txt": "س.",
   "fixes": []
  },
  {
   "id": "p016w007",
   "raw": "٢١٥١١١٦",
   "txt": "٢١٥١١١٦",
   "fixes": []
  },
  {
   "id": "p016w008",
   "raw": "لس",
   "txt": "لس",
   "fixes": []
  },
  {
   "id": "p016w009",
   "raw": "لماذا",
   "txt": "لماذا",
   "fixes": []
  },
  {
   "id": "p016w010",
   "raw": "اتصلت",
   "txt": "اتصلت",
   "fixes": []
  },
  {
   "id": "p016w011",
   "raw": "المُومياء",
   "txt": "المُومياء",
   "fixes": []
  },
  {
   "id": "p016w012",
   "raw": "بالطبيب؟",
   "txt": "بالطبيب؟",
   "fixes": []
  },
  {
   "id": "p016w013",
   "raw": "لقد",
   "txt": "لقد",
   "fixes": []
  },
  {
   "id": "p016w014",
   "raw": "اعتقدت",
   "txt": "اعتقدت",
   "fixes": []
  },
  {
   "id": "p016w015",
   "raw": "هذه",
   "txt": "هذه",
   "fixes": []
  },
  {
   "id": "p016w016",
   "raw": "الحضارات",
   "txt": "الحضارات",
   "fixes": []
  },
  {
   "id": "p016w017",
   "raw": "أنّ",
   "txt": "أنّ",
   "fixes": []
  },
  {
   "id": "p016w018",
   "raw": "الأرواح",
   "txt": "الأرواح",
   "fixes": []
  },
  {
   "id": "p016w019",
   "raw": "قد",
   "txt": "قد",
   "fixes": []
  },
  {
   "id": "p016w020",
   "raw": "تحتاج",
   "txt": "تحتاج",
   "fixes": []
  },
  {
   "id": "p016w021",
   "raw": "إلى",
   "txt": "إلى",
   "fixes": []
  },
  {
   "id": "p016w022",
   "raw": "بعض",
   "txt": "بعض",
   "fixes": []
  },
  {
   "id": "p016w023",
   "raw": "الأشياء",
   "txt": "الأشياء",
   "fixes": []
  },
  {
   "id": "p016w024",
   "raw": "في",
   "txt": "في",
   "fixes": []
  },
  {
   "id": "p016w025",
   "raw": "الحياة",
   "txt": "الحياة",
   "fixes": []
  },
  {
   "id": "p016w026",
   "raw": "الآخرة؛",
   "txt": "الآخرة؛",
   "fixes": []
  },
  {
   "id": "p016w027",
   "raw": "ولهذا",
   "txt": "ولهذا",
   "fixes": []
  },
  {
   "id": "p016w028",
   "raw": "أحياناً",
   "txt": "أحياناً",
   "fixes": []
  },
  {
   "id": "p016w029",
   "raw": "كانت",
   "txt": "كانت",
   "fixes": []
  },
  {
   "id": "p016w030",
   "raw": "المومياوات",
   "txt": "المومياوات",
   "fixes": []
  },
  {
   "id": "p016w031",
   "raw": "تُدفن",
   "txt": "تُدفن",
   "fixes": []
  },
  {
   "id": "p016w032",
   "raw": "ومعها",
   "txt": "ومعها",
   "fixes": []
  },
  {
   "id": "p016w033",
   "raw": "أسلحةٌ،",
   "txt": "أسلحةٌ،",
   "fixes": []
  },
  {
   "id": "p016w034",
   "raw": "أو",
   "txt": "أو",
   "fixes": []
  },
  {
   "id": "p016w035",
   "raw": "مجوهراتٌ،",
   "txt": "مجوهراتٌ،",
   "fixes": []
  },
  {
   "id": "p016w036",
   "raw": "أو",
   "txt": "أو",
   "fixes": []
  },
  {
   "id": "p016w037",
   "raw": "طعامٌ،",
   "txt": "طعامٌ،",
   "fixes": []
  },
  {
   "id": "p016w038",
   "raw": "أو",
   "txt": "أو",
   "fixes": []
  },
  {
   "id": "p016w039",
   "raw": "حتى",
   "txt": "حتى",
   "fixes": []
  },
  {
   "id": "p016w040",
   "raw": "حيواناتها",
   "txt": "حيواناتها",
   "fixes": []
  },
  {
   "id": "p016w041",
   "raw": "المفضلةٌ",
   "txt": "المفضلةٌ",
   "fixes": []
  },
  {
   "id": "p016w042",
   "raw": "محنطةٌ.",
   "txt": "محنطةٌ.",
   "fixes": []
  },
  {
   "id": "p016w043",
   "raw": "تنوعت",
   "txt": "تنوعت",
   "fixes": []
  },
  {
   "id": "p016w044",
   "raw": "طرق",
   "txt": "طرق",
   "fixes": []
  },
  {
   "id": "p016w045",
   "raw": "التحنيط",
   "txt": "التحنيط",
   "fixes": []
  },
  {
   "id": "p016w046",
   "raw": "في",
   "txt": "في",
   "fixes": []
  },
  {
   "id": "p016w047",
   "raw": "الحضارات",
   "txt": "الحضارات",
   "fixes": []
  },
  {
   "id": "p016w048",
   "raw": "المختلفة.",
   "txt": "المختلفة.",
   "fixes": []
  },
  {
   "id": "p016w049",
   "raw": "فبعض",
   "txt": "فبعض",
   "fixes": []
  },
  {
   "id": "p016w050",
   "raw": "الحضارات",
   "txt": "الحضارات",
   "fixes": []
  },
  {
   "id": "p016w051",
   "raw": "كانت",
   "txt": "كانت",
   "fixes": []
  },
  {
   "id": "p016w052",
   "raw": "تُجفف",
   "txt": "تُجفف",
   "fixes": []
  },
  {
   "id": "p016w053",
   "raw": "الجثت",
   "txt": "الجثت",
   "fixes": []
  },
  {
   "id": "p016w054",
   "raw": "باستخدام",
   "txt": "باستخدام",
   "fixes": []
  },
  {
   "id": "p016w055",
   "raw": "الرمل",
   "txt": "الرمل",
   "fixes": []
  },
  {
   "id": "p016w056",
   "raw": "أو",
   "txt": "أو",
   "fixes": []
  },
  {
   "id": "p016w057",
   "raw": "الدخان،",
   "txt": "الدخان،",
   "fixes": []
  },
  {
   "id": "p016w058",
   "raw": "في",
   "txt": "في",
   "fixes": []
  },
  {
   "id": "p016w059",
   "raw": "حين",
   "txt": "حين",
   "fixes": []
  },
  {
   "id": "p016w060",
   "raw": "استخدم",
   "txt": "استخدم",
   "fixes": []
  },
  {
   "id": "p016w061",
   "raw": "البعض",
   "txt": "البعض",
   "fixes": []
  },
  {
   "id": "p016w062",
   "raw": "الآخر",
   "txt": "الآخر",
   "fixes": []
  },
  {
   "id": "p016w063",
   "raw": "موانٌ",
   "txt": "موانٌ",
   "fixes": []
  },
  {
   "id": "p016w064",
   "raw": "كيميائيةٌ",
   "txt": "كيميائيةٌ",
   "fixes": []
  },
  {
   "id": "p016w065",
   "raw": "لحفظ",
   "txt": "لحفظ",
   "fixes": []
  },
  {
   "id": "p016w066",
   "raw": "الجثت،",
   "txt": "الجثت،",
   "fixes": []
  },
  {
   "id": "p016w067",
   "raw": "مثل",
   "txt": "مثل",
   "fixes": []
  },
  {
   "id": "p016w068",
   "raw": "ملح",
   "txt": "ملح",
   "fixes": []
  },
  {
   "id": "p016w069",
   "raw": "النطرون.",
   "txt": "النطرون.",
   "fixes": []
  },
  {
   "id": "p016w070",
   "raw": "المصطلحات",
   "txt": "المصطلحات",
   "fixes": []
  },
  {
   "id": "p016w071",
   "raw": "عن",
   "txt": "عن",
   "fixes": []
  },
  {
   "id": "p016w072",
   "raw": "الز",
   "txt": "الز",
   "fixes": []
  },
  {
   "id": "p016w073",
   "raw": "المومياوات",
   "txt": "المومياوات",
   "fixes": []
  },
  {
   "id": "p016w074",
   "raw": "**حضارةٌ**:",
   "txt": "حضارةٌ**:",
   "fixes": [
    "leading-punct"
   ]
  },
  {
   "id": "p016w075",
   "raw": "نظامٌ",
   "txt": "نظامٌ",
   "fixes": []
  },
  {
   "id": "p016w076",
   "raw": "اجتماعيٌ",
   "txt": "اجتماعيٌ",
   "fixes": []
  },
  {
   "id": "p016w077",
   "raw": "يُعين",
   "txt": "يُعين",
   "fixes": []
  },
  {
   "id": "p016w078",
   "raw": "الإنسان",
   "txt": "الإنسان",
   "fixes": []
  },
  {
   "id": "p016w079",
   "raw": "على",
   "txt": "على",
   "fixes": []
  },
  {
   "id": "p016w080",
   "raw": "زيادة",
   "txt": "زيادة",
   "fixes": []
  },
  {
   "id": "p016w081",
   "raw": "إنتاجه",
   "txt": "إنتاجه",
   "fixes": []
  },
  {
   "id": "p016w082",
   "raw": "في",
   "txt": "في",
   "fixes": []
  },
  {
   "id": "p016w083",
   "raw": "كافة",
   "txt": "كافة",
   "fixes": []
  },
  {
   "id": "p016w084",
   "raw": "المجالات.",
   "txt": "المجالات.",
   "fixes": []
  }
 ]
}