{
 "book": "المومياوات ناشيونال جيوجرافيك",
 "source_pdf": "المومياوات ناشيونال جيوجرافيك .pdf",
 "pdf_sha256_16": "a77d3a1ae7f90b76",
 "page": 29,
 "source": "ocr",
 "ocr_engine": "lighton/parse-v3",
 "box_level": "none",
 "diac_ratio": 0.024,
 "path": "diacritise",
 "status": "extracted",
 "tokens": [
  {
   "id": "p029w000",
   "raw": "موملاوات",
   "txt": "موملاوات",
   "fixes": []
  },
  {
   "id": "p029w001",
   "raw": "في",
   "txt": "في",
   "fixes": []
  },
  {
   "id": "p029w002",
   "raw": "الناظر",
   "txt": "الناظر",
   "fixes": []
  },
  {
   "id": "p029w003",
   "raw": "لا",
   "txt": "لا",
   "fixes": []
  },
  {
   "id": "p029w004",
   "raw": "يقتصر",
   "txt": "يقتصر",
   "fixes": []
  },
  {
   "id": "p029w005",
   "raw": "تحنيط",
   "txt": "تحنيط",
   "fixes": []
  },
  {
   "id": "p029w006",
   "raw": "الجثث",
   "txt": "الجثث",
   "fixes": []
  },
  {
   "id": "p029w007",
   "raw": "على",
   "txt": "على",
   "fixes": []
  },
  {
   "id": "p029w008",
   "raw": "العصر",
   "txt": "العصر",
   "fixes": []
  },
  {
   "id": "p029w009",
   "raw": "القديم",
   "txt": "القديم",
   "fixes": []
  },
  {
   "id": "p029w010",
   "raw": "فقط،",
   "txt": "فقط،",
   "fixes": []
  },
  {
   "id": "p029w011",
   "raw": "فبعض",
   "txt": "فبعض",
   "fixes": []
  },
  {
   "id": "p029w012",
   "raw": "الشخصيات",
   "txt": "الشخصيات",
   "fixes": []
  },
  {
   "id": "p029w013",
   "raw": "الشهيرة",
   "txt": "الشهيرة",
   "fixes": []
  },
  {
   "id": "p029w014",
   "raw": "تعرضت",
   "txt": "تعرضت",
   "fixes": []
  },
  {
   "id": "p029w015",
   "raw": "للتحنيط",
   "txt": "للتحنيط",
   "fixes": []
  },
  {
   "id": "p029w016",
   "raw": "في",
   "txt": "في",
   "fixes": []
  },
  {
   "id": "p029w017",
   "raw": "العصر",
   "txt": "العصر",
   "fixes": []
  },
  {
   "id": "p029w018",
   "raw": "الحديث.",
   "txt": "الحديث.",
   "fixes": []
  },
  {
   "id": "p029w019",
   "raw": "ثوقي",
   "txt": "ثوقي",
   "fixes": []
  },
  {
   "id": "p029w020",
   "raw": "المفكر",
   "txt": "المفكر",
   "fixes": []
  },
  {
   "id": "p029w021",
   "raw": "الإنجليزي",
   "txt": "الإنجليزي",
   "fixes": []
  },
  {
   "id": "p029w022",
   "raw": "جيريمي",
   "txt": "جيريمي",
   "fixes": []
  },
  {
   "id": "p029w023",
   "raw": "بنثام",
   "txt": "بنثام",
   "fixes": []
  },
  {
   "id": "p029w024",
   "raw": "في",
   "txt": "في",
   "fixes": []
  },
  {
   "id": "p029w025",
   "raw": "عام",
   "txt": "عام",
   "fixes": []
  },
  {
   "id": "p029w026",
   "raw": "1832.",
   "txt": "1832.",
   "fixes": []
  },
  {
   "id": "p029w027",
   "raw": "وقد",
   "txt": "وقد",
   "fixes": []
  },
  {
   "id": "p029w028",
   "raw": "أراد",
   "txt": "أراد",
   "fixes": []
  },
  {
   "id": "p029w029",
   "raw": "أن",
   "txt": "أن",
   "fixes": []
  },
  {
   "id": "p029w030",
   "raw": "يُستخدم",
   "txt": "يُستخدم",
   "fixes": []
  },
  {
   "id": "p029w031",
   "raw": "جثمائه",
   "txt": "جثمائه",
   "fixes": []
  },
  {
   "id": "p029w032",
   "raw": "في",
   "txt": "في",
   "fixes": []
  },
  {
   "id": "p029w033",
   "raw": "التجارب",
   "txt": "التجارب",
   "fixes": []
  },
  {
   "id": "p029w034",
   "raw": "العلمية،",
   "txt": "العلمية،",
   "fixes": []
  },
  {
   "id": "p029w035",
   "raw": "فأخرج",
   "txt": "فأخرج",
   "fixes": []
  },
  {
   "id": "p029w036",
   "raw": "طلاب",
   "txt": "طلاب",
   "fixes": []
  },
  {
   "id": "p029w037",
   "raw": "أعضاء",
   "txt": "أعضاء",
   "fixes": []
  },
  {
   "id": "p029w038",
   "raw": "جسمه",
   "txt": "جسمه",
   "fixes": []
  },
  {
   "id": "p029w039",
   "raw": "الداخلية،",
   "txt": "الداخلية،",
   "fixes": []
  },
  {
   "id": "p029w040",
   "raw": "وحَتَّطوا",
   "txt": "وحَتَّطوا",
   "fixes": []
  },
  {
   "id": "p029w041",
   "raw": "رأسه،",
   "txt": "رأسه،",
   "fixes": []
  },
  {
   "id": "p029w042",
   "raw": "وبعد",
   "txt": "وبعد",
   "fixes": []
  },
  {
   "id": "p029w043",
   "raw": "ذلك",
   "txt": "ذلك",
   "fixes": []
  },
  {
   "id": "p029w044",
   "raw": "ألبسوا",
   "txt": "ألبسوا",
   "fixes": []
  },
  {
   "id": "p029w045",
   "raw": "هيكله",
   "txt": "هيكله",
   "fixes": []
  },
  {
   "id": "p029w046",
   "raw": "العظميّ",
   "txt": "العظميّ",
   "fixes": []
  },
  {
   "id": "p029w047",
   "raw": "ملابسه",
   "txt": "ملابسه",
   "fixes": []
  },
  {
   "id": "p029w048",
   "raw": "ليبدو",
   "txt": "ليبدو",
   "fixes": []
  },
  {
   "id": "p029w049",
   "raw": "شكله",
   "txt": "شكله",
   "fixes": []
  },
  {
   "id": "p029w050",
   "raw": "واقعيًا",
   "txt": "واقعيًا",
   "fixes": []
  },
  {
   "id": "p029w051",
   "raw": "تماماً.",
   "txt": "تماماً.",
   "fixes": []
  },
  {
   "id": "p029w052",
   "raw": "ولا",
   "txt": "ولا",
   "fixes": []
  },
  {
   "id": "p029w053",
   "raw": "يزال",
   "txt": "يزال",
   "fixes": []
  },
  {
   "id": "p029w054",
   "raw": "بإمكان",
   "txt": "بإمكان",
   "fixes": []
  },
  {
   "id": "p029w055",
   "raw": "أي",
   "txt": "أي",
   "fixes": []
  },
  {
   "id": "p029w056",
   "raw": "شخص",
   "txt": "شخص",
   "fixes": []
  },
  {
   "id": "p029w057",
   "raw": "الذهب",
   "txt": "الذهب",
   "fixes": []
  },
  {
   "id": "p029w058",
   "raw": "لرؤيته",
   "txt": "لرؤيته",
   "fixes": []
  },
  {
   "id": "p029w059",
   "raw": "في",
   "txt": "في",
   "fixes": []
  },
  {
   "id": "p029w060",
   "raw": "إنجلترا!",
   "txt": "إنجلترا!",
   "fixes": []
  },
  {
   "id": "p029w061",
   "raw": "للسيرة",
   "txt": "للسيرة",
   "fixes": []
  }
 ]
}