{
 "book": "شكرا يامى",
 "source_pdf": "شكرا يامى.pdf",
 "pdf_sha256_16": "122b52391ef55fac",
 "page": 13,
 "source": "ocr",
 "ocr_engine": "lighton/parse-v3",
 "box_level": "none",
 "diac_ratio": 0.774,
 "path": "keep",
 "status": "extracted",
 "tokens": [
  {
   "id": "p013w000",
   "raw": "وَاتَّقَتْ",
   "txt": "وَاتَّقَتْ",
   "fixes": []
  },
  {
   "id": "p013w001",
   "raw": "مَعِي",
   "txt": "مَعِي",
   "fixes": []
  },
  {
   "id": "p013w002",
   "raw": "عَلَى",
   "txt": "عَلَى",
   "fixes": []
  },
  {
   "id": "p013w003",
   "raw": "الْعَوْدَةِ",
   "txt": "الْعَوْدَةِ",
   "fixes": []
  },
  {
   "id": "p013w004",
   "raw": "لِمُمَارَسَةِ",
   "txt": "لِمُمَارَسَةِ",
   "fixes": []
  },
  {
   "id": "p013w005",
   "raw": "الرِّياضَةِ؛",
   "txt": "الرِّياضَةِ؛",
   "fixes": []
  }
 ]
}