{
 "book": "شكرا يامى",
 "source_pdf": "شكرا يامى.pdf",
 "pdf_sha256_16": "122b52391ef55fac",
 "page": 9,
 "source": "ocr",
 "ocr_engine": "lighton/parse-v3",
 "box_level": "none",
 "diac_ratio": 0.836,
 "path": "keep",
 "status": "extracted",
 "tokens": [
  {
   "id": "p009w000",
   "raw": "في",
   "txt": "في",
   "fixes": []
  },
  {
   "id": "p009w001",
   "raw": "البَدَاءَةِ",
   "txt": "البَدَاءَةِ",
   "fixes": []
  },
  {
   "id": "p009w002",
   "raw": "شَعَرَتْ",
   "txt": "شَعَرَتْ",
   "fixes": []
  },
  {
   "id": "p009w003",
   "raw": "فَرْحُ",
   "txt": "فَرْحُ",
   "fixes": []
  },
  {
   "id": "p009w004",
   "raw": "بِالْمَلَلِ؛",
   "txt": "بِالْمَلَلِ؛",
   "fixes": []
  },
  {
   "id": "p009w005",
   "raw": "لِأَنَّهَا",
   "txt": "لِأَنَّهَا",
   "fixes": []
  },
  {
   "id": "p009w006",
   "raw": "تَعَوَّدْتُ",
   "txt": "تَعَوَّدْتُ",
   "fixes": []
  },
  {
   "id": "p009w007",
   "raw": "عَلَى",
   "txt": "عَلَى",
   "fixes": []
  },
  {
   "id": "p009w008",
   "raw": "الرُّسُومِ",
   "txt": "الرُّسُومِ",
   "fixes": []
  },
  {
   "id": "p009w009",
   "raw": "المُتَحَرِّكَةِ",
   "txt": "المُتَحَرِّكَةِ",
   "fixes": []
  },
  {
   "id": "p009w010",
   "raw": "السَّرِيعَةِ؛",
   "txt": "السَّرِيعَةِ؛",
   "fixes": []
  },
  {
   "id": "p009w011",
   "raw": "لِكَثَنِي",
   "txt": "لِكَثَنِي",
   "fixes": []
  },
  {
   "id": "p009w012",
   "raw": "كُنْتُ",
   "txt": "كُنْتُ",
   "fixes": []
  },
  {
   "id": "p009w013",
   "raw": "ذِكِيَّةً",
   "txt": "ذِكِيَّةً",
   "fixes": []
  },
  {
   "id": "p009w014",
   "raw": "فِي",
   "txt": "فِي",
   "fixes": []
  },
  {
   "id": "p009w015",
   "raw": "اخْتِيَارِ",
   "txt": "اخْتِيَارِ",
   "fixes": []
  },
  {
   "id": "p009w016",
   "raw": "الْقِصَصِ،",
   "txt": "الْقِصَصِ،",
   "fixes": []
  },
  {
   "id": "p009w017",
   "raw": "فَاشْتَرِيثُ",
   "txt": "فَاشْتَرِيثُ",
   "fixes": []
  },
  {
   "id": "p009w018",
   "raw": "لَهَا",
   "txt": "لَهَا",
   "fixes": []
  },
  {
   "id": "p009w019",
   "raw": "قِصَصًا",
   "txt": "قِصَصًا",
   "fixes": []
  },
  {
   "id": "p009w020",
   "raw": "جَذَّابَةً",
   "txt": "جَذَّابَةً",
   "fixes": []
  },
  {
   "id": "p009w021",
   "raw": "وَتَفَاعُلِيَّةً.",
   "txt": "وَتَفَاعُلِيَّةً.",
   "fixes": []
  },
  {
   "id": "p009w022",
   "raw": "وَتَسَاءَلْتُ",
   "txt": "وَتَسَاءَلْتُ",
   "fixes": []
  },
  {
   "id": "p009w023",
   "raw": "فَرْحُ",
   "txt": "فَرْحُ",
   "fixes": []
  },
  {
   "id": "p009w024",
   "raw": "أَيْنَ",
   "txt": "أَيْنَ",
   "fixes": []
  },
  {
   "id": "p009w025",
   "raw": "هُوَ",
   "txt": "هُوَ",
   "fixes": []
  },
  {
   "id": "p009w026",
   "raw": "فِيلُمُ",
   "txt": "فِيلُمُ",
   "fixes": []
  },
  {
   "id": "p009w027",
   "raw": "الْكَرَّزُونِ؟",
   "txt": "الْكَرَّزُونِ؟",
   "fixes": []
  }
 ]
}