{
 "book": "شكرا يامى",
 "source_pdf": "شكرا يامى.pdf",
 "pdf_sha256_16": "122b52391ef55fac",
 "page": 15,
 "source": "ocr",
 "ocr_engine": "lighton/parse-v3",
 "box_level": "none",
 "diac_ratio": 0.698,
 "path": "keep",
 "status": "extracted",
 "tokens": [
  {
   "id": "p015w000",
   "raw": "وَنَقْضِي",
   "txt": "وَنَقْضِي",
   "fixes": []
  },
  {
   "id": "p015w001",
   "raw": "مَعًا",
   "txt": "مَعًا",
   "fixes": []
  },
  {
   "id": "p015w002",
   "raw": "أَخْلَى",
   "txt": "أَخْلَى",
   "fixes": []
  },
  {
   "id": "p015w003",
   "raw": "الأَوْقَاتِ",
   "txt": "الأَوْقَاتِ",
   "fixes": []
  },
  {
   "id": "p015w004",
   "raw": "فِي",
   "txt": "فِي",
   "fixes": []
  },
  {
   "id": "p015w005",
   "raw": "الْقِرَاءَةِ",
   "txt": "الْقِرَاءَةِ",
   "fixes": []
  },
  {
   "id": "p015w006",
   "raw": "وَمُمَارَسَةِ",
   "txt": "وَمُمَارَسَةِ",
   "fixes": []
  },
  {
   "id": "p015w007",
   "raw": "النَّشَاطَاتِ.",
   "txt": "النَّشَاطَاتِ.",
   "fixes": []
  }
 ]
}